"#","LISTING","TAGS","LISTING ID","TOTAL VIEWS","FAVORITES","EST. SALES","EST. REVENUE","PRICE","LISTING AGE","DAILY VIEWS","LAST UPDATED"
1,"Samsung Frame TV Art, Neutral Floral Screensaver, Beige Wildflowers, White Summer Flowers Painting, Farmhouse TV Art, Digital Download TV400","Frame TV Art Spring, Warm Tone Painting, Muted Tonal Frame TV, Country Frame TV Art, Wildflower Frame TV, Floral Frame TV Art, Digital Floral Art, Cottage Country, Samsung Frame TV Art, Frame TV Art Flowers, Wildflower Field, Summer Frame TV Art, Neutral Tone Art",1703122720,"6,156","331","203","€1,203.79","€5.18",816,7.54,"7/14/2026 20:21"
2,"Vintage Wildflower Meadow Print, Cottage Painting, Moody Fall Wall Art | A847","Printable Wall Art, Vintage Painting, Wildflower Print, Vintage Art Print, Downloadable Print, Antiquewhiteart, rustic wall art, fall wall art, cottagecore print, Floral Art Print, Thanksgiving prints, floral painting, Cottage Art print",4525565952,"24","0","0","€0","€6.27",23,1.04,"7/14/2026 19:56"
3,"Printable Halloween Wall Art, Bats & Full Moon Painting, Haunted Prints, Vintage Autumn Painting, Moody Rustic Decor, Digital Download |A582","Halloween Wall Art, Spooky Decor, Bat Art, Full Moon Art, Antiquewhiteart, Moody Halloween, Vintage Painting, Rustic Wall Art, Farmhouse Decor, Printable Wall Art, Cool Tones, Bats Print, Haunted Decor",4353647208,"108","10","3","€20.49","€5.97",331,0.33,"7/14/2026 19:04"
4,"200+ Frame tv Art, ALL-IN-ONE Collection (Digital Download)| TS108","Frame TV Art, AntiqueWhiteArt, Easter Frame TV, Frame TV art set, Frame TV digital art, Frame TV art bundle, Samsung Frame TV art, 4th of July Frame TV, Halloween Frame TV, Christmas Frame TV, All season art, Frame TV bundle, Bundles Frame TV",4458099690,"9,978","395","160","€5,137.6","€28.07",149,66.97,"7/14/2026 18:55"
5,"Frame TV Art, Beach Painting Frame Tv, Summer Sea Print, Ocean Screensaver TV, Coastal Landscape, Nautical Seascape, Digital Download |TV629","Summer Frame TV Art, Samsung Frame TV Art, Digital Download, Downloadable Art, Art for Frame TV, Beach Painting, Coastal Summer, Instant Download, Beach Frame Tv Art, Country Frame TV Art, Vintage Sea Frame TV, Ocean Frame TV, Frame Tv",4296675439,"1,816","111","93","€436.17","€4.1",444,4.09,"7/14/2026 18:48"
6,"Printable Christmas Prints, Set of 7 Rustic Winter Gallery Wall Art, Santa Claus Print, Christmas Tree Print, Vintage Christmas Decor | S96","Printable Wall Art, winter prints, Christmas Prints, Christmas Decor, antiquewhiteart, holiday art print, digital download, downloadable art, Winter Wall Art, Christmas Tree Print, Santa Claus Painting, Christmas Gallery, Winter Painting",1826692033,"413","20","10","€143.7","€12.56",605,0.68,"7/14/2026 18:06"
7,"PRINTABLE Moody Christmas Wall Art, Brass Bells Rustic Oil Painting, Country Christmas Print, Holiday Wall Decor, Digital Download | W117","Christmas Prints, Christmas Wall Art, Winter Painting, Christmas Decor, Christmas Tree Print, Antiquewhiteart, Printable Wall Art, Moody Christmas, Bells Art, Christmas Home Decor, Vintage Prints, Country Christmas, Winter Art Prints",1818234053,"910","74","30","€225.6","€6.57",621,1.47,"7/14/2026 18:06"
8,"Printable Muted Wildflowers Wall Art, Muted Vintage Meadow Painting, Rustic Farmhouse Decor, Autumn Prints, Floral Art Digital Download A523","Printable Wall Art, Vintage Painting, Wildflower Print, Vintage Art Print, Downloadable Print, Farmhouse Print, Antiquewhiteart, country wall decor, rustic wall art, fall wall art, autumn decor, cottagecore print, Floral Art Print",4335758315,"9,137","551","302","€2,165.34","€6.27",364,25.1,"7/14/2026 17:28"
9,"Samsung Frame TV Art, Moody Mountain Landscape, Vintage Country Oil Painting, Farmhouse Decor, Digital Download, Spring Frame TV Art | TV01","Frame TV Art Spring, Frame TV Art Vintage, Samsung Frame TV Art, Spring Frame TV Art, Muted Tonal Frame TV, Wildflower Field, Country Frame TV art, Digital Floral Art, Cottage Country, Muted Tonal Art, Warm Tone Painting, Farmhouse Decor, Living TV art",1635615275,"476","37","15","€88.95","€5.18",942,0.51,"7/14/2026 15:43"
10,"Haunted House Halloween Printable Wall Art, Moody Gothic Print | A884","Haunted House Print, Landscape painting, AntiqueWhiteArt, Moody gothic print, Printable wall art, digital download, Dark Wall Art, mystic Wall Art, Dark academia print, Halloween Painting, halloween print, spooky halloween, Seasonal prints",4536645486,"1","0","0","€0","€6.74",2,0.5,"7/14/2026 15:09"
11,"Vintage Halloween Ghost Print, Black Cat, Whimsical Witch Art (Digital Download) A848","Halloween Decor, Digital Art Prints, Ghost Print, Halloween Printable, Vintage Decor, Ghost Painting, Digital Download, Antiquewhiteart, halloween wall art, ghost wall art, witch wall art, spooky printable, halloween print",4525567021,"25","0","0","€0","€5.8",23,1.09,"7/14/2026 14:49"
12,"Spooky Ghosts Laundry Room Art, Vintage Farmhouse Halloween Print (Digital Download) | A874","halloween wall art, antiquewhiteart, cute ghost print, laundry room art, farmhouse halloween, vintage halloween, halloween print, ghost halloween art, spooky cute art, linen line art, halloween download, printable wall art, halloween decor",4536604652,"1","0","0","€0","€5.97",2,0.5,"7/14/2026 14:05"
13,"Samsung Frame TV Art, Summer Wildflower Field, Country Flowers Art, Warm Tone Wildflowers Art,  Digital Download Frame TV Art | TV573","Frame TV Art Spring, Frame TV Art Vintage, Samsung Frame TV Art, Spring Frame TV Art, Muted Tonal Frame TV, Wildflower Field, Country Frame TV art, Digital Floral Art, Cottage Country, Muted Tonal Art, Warm Tone Painting, Farmhouse Decor, AntiqueWhiteAt",1858362928,"1,778","113","58","€472.7","€7.12",518,3.43,"7/14/2026 13:44"
14,"Whimsical Ghost  Bathtub Print, Spooky Cottagecore Bathroom Decor  (Digital Download) | A878","bathroom wall art, ghost in bathtub, ghost painting, halloween printable, funny halloween art, kids halloween art, vintage halloween, retro ghost decor, nursery wall art, antique white art, spooky bathroom, earth tones prints, fall wall art",4536637173,"0","0","0","€0","€5.97",2,0,"7/14/2026 13:41"
15,"HAND-DRAWN Halloween & Fall Frame TV Art Bundle, Spooky Season Decor, Digital Download |TS112","Samsung Frame TV, ghost Frame tv, Frame TV art, Samsung Art Download, Frame TV Art Set, Halloween TV Art set, Digital Art set, Frame TV Halloween, antiquewhiteart, spooky frame tv, Halloween Decor, Large Bundle, Vintage Halloween",4521361964,"16","0","0","€0","€25.07",31,0.52,"7/14/2026 13:20"
16,"LARGE Halloween & Fall Frame TV Art Bundle, Spooky Season Decor, Digital Download |TS111","Samsung Frame TV, ghost Frame tv, Frame TV art, Samsung Art Download, Frame TV Art Set, Halloween TV Art set, Digital Art set, Frame TV File, Frame TV Halloween, antiquewhiteart, spooky frame tv, Halloween Decor, Large Bundle",4518359497,"20","0","0","€0","€28.07",36,0.56,"7/14/2026 12:50"
17,"Printable Pumpkin Wall Art, Moody Fall Floral Painting (Digital Download) | A892","vintage halloween, printable wall art, antiquewhiteart, pumpkin wall art, fall printable art, moody autumn decor, rustic fall print, autumn floral art, seasonal wall art, farmhouse autumn, thanksgiving art, dark fall art, fall wall art",4536652322,"2","0","0","€0","€5.97",2,1,"7/14/2026 11:33"
18,"Vintage Halloween Ghost owith a Candle Print, Moody Spooky Wall Art (Digital Download) | A895","Halloween Decor, Digital Art Prints, Ghost Print, Halloween Printable, Digital Download, Ghosts Art Pint, Halloween Print, Antiquewhiteart, Ghost Wall Art, Printable Art, Cute Ghost Decor, Goth prints, cottagecore fall",4536655946,"2","0","0","€0","€5.8",2,1,"7/14/2026 11:30"
19,"Vintage Halloween Ghost Print, Moody Witchy Wall Art (Digital Download) | A882","Halloween Decor, Digital Art Prints, Ghost Print, Halloween Printable, Digital Download, Ghosts Art Pint, Halloween Print, Antiquewhiteart, Ghost Wall Art, Printable Art, Cute Ghost Decor, Goth prints, cottagecore fall",4536643252,"5","0","0","€0","€5.8",2,2.5,"7/14/2026 11:16"
20,"Cottagecore Halloween Print, Vintage Style Textile Wall Art (Digital Download) A881","Halloween Decor, Digital Art Prints, Halloween Printable, Vintage Decor, Digital Download, Halloween Print, Antiquewhiteart, cross stitch art, embroidery print, folk art decor, cottagecore decor, farmhouse fall decor, vintage wall art",4536581606,"3","0","0","€0","€5.8",2,1.5,"7/14/2026 10:32"
21,"Floral Crow Print, Victorian Halloween Wall Art (Instant Download) A886","dark academia, antiquewhiteart, moody painting, halloween decor, vintage ghost, printable wall art, victorian print, vintage halloween, halloween print, witchy cottagecore, floral wall art, bats wall art, halloween gothic",4536573877,"3","0","0","€0","€4.27",2,1.5,"7/14/2026 10:30"
22,"Printable Winter Wall Art, Farmhouse Christmas Sketch, Rustic Pine Trees Print, Winter Forest Art, Neutral Country Christmas Decor | W89","Christmas decor, vintage winter art, printable wall art, winter painting, vintage wall art, winter forest print, Christmas wall art, antiquewhiteart, digital download, Pine Forest Art, Rustic Pine Forest, Winter Pine Art, Vintage Sketch",1623697415,"982","87","32","€240.64","€6.57",956,1.03,"7/14/2026 09:44"
23,"Black Cat Print, Victorian Halloween Wall Art (Instant Download) A891","dark academia, antiquewhiteart, moody painting, halloween decor, vintage ghost, printable wall art, victorian print, vintage halloween, halloween print, witchy cottagecore, floral wall art, black cat print, halloween gallery",4536574675,"1","0","0","€0","€4.27",2,0.5,"7/14/2026 09:21"
24,"Dark Ghost Print, Moody Halloween Wall Art (Digital Download) A876","Halloween Decor, Digital Art Prints, Ghost Print, Halloween Printable, Vintage Decor, Ghost Painting, Digital Download, Antiquewhiteart, ghost wall art, spooky printable, spooky ghost art, dark academia, goth prints",4536634546,"0","0","0","€0","€5.8",2,0,"7/14/2026 09:13"
25,"Printed & Shipped Farmhouse Print Art, Mailed Landscape Painting, Printed Vintage Wall Art, Gallery Set Prints, AntiqueWhiteArt","antiquewhiteart, Fall Prints, gallery wall set, Mailed Prints, Printed Artwork, Printing Service, Printed Art, Vintage Landscape, Wildflower Print, Vintage Art Print, Gallery Set, Farmhouse Prints, Vintage Oil Painting",1787656315,"1,393","38","28","€645.68","€20.16",680,2.05,"7/14/2026 08:28"
26,"Witchy Black Cat Print, Spooky Nursery Wall Art (Instant Download) A893","antiquewhiteart, moody painting, halloween decor, vintage ghost, printable wall art, vintage halloween, halloween print, witchy cottagecore, black cat print, halloween gallery, Kids Halloween Art, Nursery Halloween, Witchy Black Cat Art",4536653498,"1","0","0","€0","€4.27",2,0.5,"7/14/2026 08:07"
27,"Halloween Ghost with Popcorn Art Print, Spooky Haunted Decor (Digital Download) | A877","Ghost Painting, Halloween Decor, Antiquewhiteart, Cute Ghost Art, Digital Printable, Fun Halloween Art, Instant Download, Halloween Art, Spooky Print, Fun Halloween Print, Kitchen Decor, Fun Halloween Decor, Dining wall art",4536619763,"1","0","0","€0","€6.27",2,0.5,"7/14/2026 07:43"
28,"Black Cat Halloween Art Print, Fun Neutral Fall Decor (Digital Download) |  A866","halloween Wall Art, Printable Wall art, antiquewhiteart, halloween printable, fall wall art, digital download, whimsical wall art, fun halloween print, toilet wall art, moody wall art, cat wall art, black cat, shabby chic art",4536571030,"4","0","0","€0","€6.74",2,2,"7/14/2026 07:14"
29,"Witchy Duck Print, Moody Gothic Halloween Wall Art (Instant Download) A879","dark academia, antiquewhiteart, moody painting, halloween decor, vintage ghost, printable wall art, vintage halloween, halloween print, witchy cottagecore, halloween gallery, goose witch print, vintage duck print, Trendy Wall Art",4536641680,"3","0","0","€0","€4.27",2,1.5,"7/14/2026 07:05"
30,"Crows Halloween Art Print, Fun Neutral Fall Decor (Digital Download) |  A864","halloween Wall Art, Printable Wall art, antiquewhiteart, halloween printable, fall wall art, digital download, whimsical wall art, funny bird art, fun halloween print, toilet wall art, crow pint, moody wall art, bird print",4536552911,"0","0","0","€0","€6.74",2,0,"7/14/2026 06:58"
31,"Printable Pumpkin Wall Art, Moody Fall Floral Painting (Digital Download) | A888","vintage halloween, printable wall art, antiquewhiteart, pumpkin wall art, fall printable art, moody autumn decor, rustic fall print, autumn floral art, seasonal wall art, farmhouse autumn, thanksgiving art, dark fall art, fall wall art",4536649492,"4","1","0","€0","€5.97",2,2,"7/14/2026 06:36"
32,"Pigeons Halloween Art Print, Fun Neutral Fall Decor (Digital Download) |  A865","halloween Wall Art, Printable Wall art, vintage halloween, neutral fall decor, antiquewhiteart, halloween printable, fall wall art, digital download, whimsical wall art, funny bird art, fun halloween print, toilet wall art, pigeon print",4536552753,"0","0","0","€0","€6.74",2,0,"7/14/2026 06:25"
33,"Halloween Wall Art: Funny Spooky Bathroom Print, Ghost on Toilet (Instant Download) | A873","ghost painting, antiquewhiteart, ghost wall art, instant download, Spooky print, Bathroom Halloween, Halloween Bathroom, Halloween Wall Art, Ghost Bathroom Art, Halloween Prints, ghost on toilet art, ghost reading print, victorian prints",4536587213,"1","0","0","€0","€6.27",2,0.5,"7/14/2026 06:11"
34,"50+ Halloween & Fall Gallery Bundle, Cottagecore Print Set, Printable Wall Art (Digital Download) | S207","halloween wall art, fall wall art, vintage halloween, printable wall art, halloween decor, fall decor, gallery wall set, ghost wall art, cottagecore decor, vintage print set, dark academia art, instant download, antiquewhiteart",4533094838,"237","10","4","€84.28","€18.42",8,29.63,"7/14/2026 05:46"
35,"Black Cat Halloween Art Print, Fun Neutral Fall Decor (Digital Download) |  A887","halloween Wall Art, Printable Wall art, antiquewhiteart, halloween printable, fall wall art, digital download, whimsical wall art, fun halloween print, toilet wall art, moody wall art, cat wall art, black cat, shabby chic art",4536558717,"3","0","0","€0","€6.74",2,1.5,"7/14/2026 04:58"
36,"Spring Bunny Samsung Frame TV Art, Easter Bunny TV Art, Country Spring Painting, Vintage Style Rabbit Farmhouse TV, Digital Download | TV591","Spring TV Art, Samsung Frame TV Art, Digital Download, Frame TV Vintage Art, Frame TV Spring, Easter TV Art, Easter Frame TV Art, Wildflower Field, Cottagecore Decor, Rabbit Painting, Easter Bunny TV Art, Country Easter, AntiqueWhiteArt",1883891525,"355","24","11","€89.65","€7.12",495,0.72,"7/14/2026 04:24"
37,"Frog Halloween Art Print, Fun Fall Decor (Digital Download) |  A868","halloween Wall Art, Printable Wall art, antiquewhiteart, halloween printable, fall wall art, digital download, whimsical wall art, fun halloween print, toilet wall art, moody wall art, shabby chic art, frog wall art, trendy wall art",4536556829,"3","1","0","€0","€6.74",2,1.5,"7/14/2026 04:21"
38,"Black Cat Halloween Art Print, Fun Neutral Fall Decor (Digital Download) |  A866","halloween Wall Art, Printable Wall art, antiquewhiteart, halloween printable, fall wall art, digital download, whimsical wall art, fun halloween print, toilet wall art, moody wall art, cat wall art, black cat, shabby chic art",4536571130,"4","1","0","€0","€6.74",2,2,"7/14/2026 03:38"
39,"Ghost Reading Print, Spooky Fall Decor (Instant Download) A889","Gothic Painting, goth decor, Cottagecore Art, Halloween Decor, spooky art, Coffee Lover Gift, Halloween Kitchen, Ghost coffee, Cozy Cottage, Fall Wall Decor, Autumn Decor, halloween print, moody painting",4536634027,"2","0","0","€0","€4.27",2,1,"7/14/2026 02:54"
40,"Whimsical Ghost  Bathtub Print, Spooky Cottagecore Bathroom Decor  (Digital Download) | A878","bathroom wall art, ghost in bathtub, ghost painting, halloween printable, funny halloween art, kids halloween art, vintage halloween, retro ghost decor, nursery wall art, antique white art, spooky bathroom, earth tones prints, fall wall art",4536639212,"1","1","0","€0","€5.97",2,0.5,"7/14/2026 02:51"
41,"Halloween Wall Art: Funny Spooky Bathroom Print, Ghost on Toilet (Instant Download) | A873","ghost painting, antiquewhiteart, ghost wall art, instant download, Spooky print, Bathroom Halloween, Halloween Bathroom, Halloween Wall Art, Ghost Bathroom Art, Halloween Prints, ghost on toilet art, ghost reading print, victorian prints",4536604732,"4","1","0","€0","€6.27",2,2,"7/14/2026 02:39"
42,"Vintage Christmas Frame TV Art: Farmhouse Santa, Trees (Digital Download) TS85","Samsung Frame TV, Frame TV Art Set, Frame Tv Christmas, country christmas, winter frame tv, Christmas Frame TV, christmas decor, Santa Frame TV, christmas tv art, digital download, farmhouse christmas, frame tv art, Christmas Tree Art",4389921181,"177","7","4","€58.84","€12.86",267,0.66,"7/14/2026 02:24"
43,"Ghost Reading Print, Spooky Fall Decor (Instant Download) A883","library painting, bookworm gift, dark academia, antiquewhiteart, booklover gift, ghost reading, bookish decor, ghost painting, ghost print, moody painting, spooky decor, halloween decor, vintage ghost",4536627799,"0","0","0","€0","€4.27",2,0,"7/14/2026 02:21"
44,"Vintage Halloween Ghost Print, Moody Witchy Wall Art (Digital Download) | A882","Halloween Decor, Digital Art Prints, Ghost Print, Halloween Printable, Digital Download, Ghosts Art Pint, Halloween Print, Antiquewhiteart, Ghost Wall Art, Printable Art, Cute Ghost Decor, Goth prints, cottagecore fall",4536637011,"1","0","0","€0","€5.8",2,0.5,"7/14/2026 01:14"
45,"Printable Vintage Christmas Prints, Santa Claus Print, Set of Moody Winter Wall Arts, Farmhouse Christmas Decor, Digital Download | S40","Printable Wall Art, winter prints, Christmas Prints, Holiday Arts, Christmas Decor, antiquewhiteart, holiday art print, digital download, downloadable art, Moody Wall Arts, Winter Wall Art, Christmas Tree Print, Santa Claus Painting",1604073469,"4,429","177","100","€1,911","€16.7",981,4.51,"7/14/2026 00:45"
46,"Vintage Christmas Print Set of 20+: Neutral Holiday Gallery Wall (Digital Download) S155","Printable Wall Art, Christmas decor, antiquewhiteart, digital download, Christmas Tree Print, Digital Prints, vintage christmas, Winter Holiday Decor, christmas wall art, Christmas prints, Christmas Bundle, Large Set of Prints, Neutral Christmas",4389781892,"769","47","14","€375.06","€23.42",267,2.88,"7/13/2026 21:26"
47,"Vintage Christmas Print Set of 20+: Neutral Holiday Gallery Wall (Digital Download) S154","Printable Wall Art, Christmas decor, antiquewhiteart, digital download, Christmas Tree Print, Digital Prints, vintage christmas, Winter Holiday Decor, christmas wall art, Christmas prints, Christmas Bundle, Large Set of Prints, Neutral Christmas",4389760072,"491","22","9","€241.11","€23.42",267,1.84,"7/13/2026 21:26"
48,"Wheat Wildflower Field Print, Neutral Landscape Painting (Digital Download) | A809","Wildflower Print, Downloadable Print, Downloadable Prints, Digital Prints, Floral Print, Neutral Wall Art, Printable Wall Art, Wildflower Field, Digital Floral Art, Meadow landscape, AntiqueWhiteArt, Spring Decor, Over Bed Wall Art",4470907594,"44","4","1","€8.21","€7.18",124,0.35,"7/13/2026 21:05"
49,"50+ Halloween & Fall Gallery Bundle, Cottagecore Print Set, Printable Wall Art (Digital Download) | S206","halloween wall art, fall wall art, vintage halloween, printable wall art, halloween decor, fall decor, gallery wall set, ghost wall art, cottagecore decor, vintage print set, dark academia art, instant download, antiquewhiteart",4531686509,"56","3","1","€21.07","€18.42",11,5.09,"7/13/2026 20:44"
50,"Tropical Summer Samsung Frame TV Art, Neutral Coastal Oil Painting, Beach Palms Screensaver, Summer Art for TV, Digital Download | TV421","Samsung Frame TV Art, Summer Frame TV, Beach Ocean, Coastal cottage, Digital Download, Summer Beach Art, TV Download, Frame TV Art, Beach House Art, Framed TV Art, Samsung Frame TV, Palm Art, Tropical Beach Art",1730052021,"976","80","50","€234.5","€4.1",793,1.23,"7/13/2026 18:54"
51,"Printable Coastal Wildflowers Set of 2 Prints, Neutral Summer Landscape Painting, Vintage Coastal Landscape, Summer Flowers Print | S79","Printable Wall Art, Wildflower Print, Farmhouse Print, Digital Prints, Cottagecore Decor, Summer Print, Landscape Painting, Farmhouse Decor, Floral Print, Downloadable Prints, Neutral Wall Art, Coastal Prints, Coastal Print",1734012059,"31,633","2,638","1,047","€10,312.95","€8.61",786,40.25,"7/13/2026 18:00"
52,"Large Wall Art, Wildflower Field Landscape Print, Modern Spring Decor Painting","Printed and Shipped, Shipped Canvas, Large Size Canvas, country farmhouse, large framed canvas, modern living room, nature landscape art, neutral oil painting, landscape painting, bedroom prints, spring decor, spring canvas art, Wildflower Field",4435585939,"415","12","6","€187.56","€27.32",190,2.18,"7/13/2026 17:40"
53,"Vintage Christmas Prints: Neutral Gallery Set of 6, Santa Painting & Holiday Decor | S159","Printable Wall Art, Vintage Prints, Christmas decor, antiquewhiteart, digital download, Neutral Prints, Christmas Tree Print, Digital Prints, vintage christmas, Winter Holiday Decor, christmas wall art, Christmas prints, Christmas Bundle",4389854826,"771","28","17","€338.81","€17.42",267,2.89,"7/13/2026 16:03"
54,"Vintage Christmas Prints: Neutral Gallery Set of 6, Santa Painting & Holiday Decor | S145","Printable Wall Art, Vintage Prints, Christmas decor, antiquewhiteart, digital download, Neutral Prints, Christmas Tree Print, Digital Prints, vintage christmas, Winter Holiday Decor, christmas wall art, Christmas prints, Christmas Bundle",4384661603,"739","54","16","€318.88","€17.42",277,2.67,"7/13/2026 15:59"
55,"Large Wall Art, Cottage Country Landscape Print, Modern Spring Decor Painting | A401","Printed and Shipped, Mailed Canvas Art, Shipped Canvas, Large Size Canvas, country farmhouse, large framed canvas, modern living room, nature landscape art, neutral oil painting, landscape painting, bedroom prints, spring decor, spring canvas art",4435587594,"4,528","187","72","€2,250.72","€27.32",190,23.83,"7/13/2026 06:10"
56,"Printable Fall Sunset Wall Art, Vintage Fall Prints, Muted Autumn Print, Country Landscape Painting, Neutral Art, Digital Download | A476","printable wall art, fall print, fall landscape, vintage print, digital prints, neutral landscape, vintage landscape, Fall Decor, antiquewhiteart, Fall Sunset, Country Wall Art, Rustic Country Decor, Autumn Landscape",4328384031,"216","29","7","€50.19","€6.27",378,0.57,"7/13/2026 04:04"
57,"Country Landscape Painting, Vintage Farmhouse Decor, Summer Rustic Print, Printable Wall Art, Digital Download | A28","antique art print, country landscape, farmhouse decor, french country decor, garden painting, landscape painting, nature painting, printable wall art, rustic wall decor, summer painting, vintage art print, vintage landscape, vintage oil painting",1453939838,"3,284","200","108","€774.36","€6.27",1177,2.79,"7/13/2026 04:04"
58,"Printable Fall Wildflower Wall Art, Muted Vintage Meadow Painting, Rustic Cottagecore Decor, Farmhouse Autumn Prints, Digital Download |A550","Printable Wall Art, Vintage Painting, Wildflower Print, Vintage Art Print, Downloadable Print, Farmhouse Print, Antiquewhiteart, country wall decor, rustic wall art, fall wall art, autumn decor, cottagecore print, Floral Art Print",4340159347,"1,171","85","38","€272.46","€6.27",356,3.29,"7/13/2026 04:04"
59,"Personalized Ghost Family Portrait, Custom Halloween Wall Art","custom family print, ghost family decor, halloween wall art, antiquewhiteart, halloween keepsake, ghost family, family print, custom halloween, family portrait, personalized gift, halloween gift, halloween decor, personalized print",4536822487,"5","0","0","€0","€24.36",1,5,"7/13/2026 03:17"
60,"Personalized Ghost Family Portrait, Custom Halloween Wall Art","custom family print, ghost family decor, halloween wall art, antiquewhiteart, halloween keepsake, ghost family, family print, custom halloween, family portrait, personalized gift, halloween gift, halloween decor, personalized print",4536823417,"6","0","0","€0","€24.36",1,6,"7/13/2026 03:16"
61,"Personalized Ghost Family Portrait, Custom Halloween Wall Art","custom family print, ghost family decor, halloween wall art, antiquewhiteart, halloween keepsake, ghost family, family print, custom halloween, family portrait, personalized gift, halloween gift, halloween decor, personalized print",4536839374,"5","0","0","€0","€24.36",1,5,"7/13/2026 03:08"
62,"Personalized Ghost Family Portrait, Custom Halloween Wall Art","custom family print, ghost family decor, halloween wall art, antiquewhiteart, halloween keepsake, ghost family, family print, custom halloween, family portrait, personalized gift, halloween gift, halloween decor, personalized print",4536838902,"3","0","0","€0","€24.36",1,3,"7/13/2026 03:06"
63,"PRINTABLE Rustic Winter Landscape Wall Art, Winter Cabin Print, Farmhouse Winter Prints, Pine Forest Painting, Digital Download | W151","vintage winter art, printable wall art, winter painting, vintage wall art, digital art print, farmhouse decor, forest painting, winter wall art, rustic landscape, winter cabin print, winter print, neutral winter print, winter forest print",1811679732,"1,901","134","62","€444.54","€6.27",607,3.13,"7/13/2026 02:58"
