"#","LISTING","TAGS","LISTING ID","TOTAL VIEWS","FAVORITES","EST. SALES","EST. REVENUE","PRICE","LISTING AGE","DAILY VIEWS","LAST UPDATED"
357,"PRINTABLE Vintage Halloween Print, Cute Ghost and Black Cat in Dark Forest Wall Art, Spooky Halloween Digital Art, Moody Fall Decor | A513","Halloween Decor, Digital Art Prints, Ghost Print, Halloween Printable, Vintage Decor, Ghost Painting, Digital Download, Ghosts Art Pint, Halloween Print, Antiquewhiteart, Oil Painting, Cute Ghost, Spooky Prints",4334479433,"2,126","152","70","€464.8","€5.8",367,5.79,"7/5/2026 19:34"
358,"Printable Wildflower Wall Art, Moody Painting, Floral Art | Digital Download | A653","Printable Wall Art, Vintage Painting, Wildflower Print, Vintage Art Print, Downloadable Print, Farmhouse Print, Antiquewhiteart, country wall decor, rustic wall art, cottagecore print, Floral Art Print, Moody Floral, Wild Flowers Art",4434904122,"109","18","3","€21.51","€6.27",192,0.57,"7/5/2026 19:34"
359,"Coastal Cottage Frame TV Art, Monet Landscape, Vintage Neutral Wall Decor, Warm Tones Painting, Digital Download | TV09","Frame TV Art Spring, Frame TV Art Vintage, Samsung Frame TV Art, Country Frame TV art, Cottage Country, Farmhouse Decor, Living TV art, Cottage Painting, Cottage Garden Decor, Cottagecore Art, Coastal Frame TV, Summer Frame TV, Monet TV Art",1508938867,"410","30","13","€77.09","€5.18",1118,0.37,"7/5/2026 19:33"
360,"Samsung Frame TV Art, Wildflower Field Landscape, Moody Country Field, Vintage Meadow Painting, Digital Download, Frame TV Art |  TV30","Frame TV Art Spring, Frame TV Art Vintage, Samsung Frame TV Art, Spring Frame TV Art, Muted Tonal Frame TV, Wildflower Field, Country Frame TV art, Digital Floral Art, Cottage Country, Muted Tonal Art, Warm Tone Painting, Farmhouse Decor, Living TV art",1442529688,"674","36","22","€179.3","€7.12",1194,0.56,"7/5/2026 19:31"
361,"Coastal American Cottage Painting, 4th of July, Hydrangea Garden Print (Digital Download) A826","Printable Wall Art, Downloadable Print, Summer Wall Decor, Cottage Garden Decor, Summer Art, 4th of July Painting, Independence Day, USA Painting, 4th of July Art, American Flag, Coastal Print, Farmhouse Decor, USA Oil Painting",4485467166,"259","12","8","€45.92","€5.02",97,2.67,"7/5/2026 19:30"
362,"PRINTED Swan Wall Art Print, Vintage Moody Painting, Romantic Home Decor","Large Size Canvas, large framed canvas, modern living room, landscape painting, bedroom prints, Cottagecore Wall Art, Mantel Farmhouse Art, Swan wall Art, Dark Moody Painting, Romantic decor, Vintage Art Print, Vintage Framed Art, Farmhouse Wall Art",4453502913,"491","51","7","€240.66","€30.05",158,3.11,"7/5/2026 19:06"
363,"Large Wall Art, Cottage Country Landscape Print, Modern Spring Decor Painting","Printed and Shipped, Mailed Canvas Art, Shipped Canvas, Large Size Canvas, country farmhouse, large framed canvas, modern living room, nature landscape art, neutral oil painting, landscape painting, bedroom prints, spring decor, spring canvas art",4525694776,"34","4","0","€0","€27.32",23,1.48,"7/5/2026 19:04"
364,"Easter Wall Art, Vintage Style Painting, Bunny Print, Printed And Shipped | A693","Large Size Canvas, large framed canvas, modern living room, landscape painting, bedroom prints, spring decor, spring canvas art, Rabbit Wall Art, Spring Bunny Print, Vintage Bunny Art, Cottagecore Wall Art, Mantel Farmhouse Art, Easter Wall Decor",4453241787,"140","6","2","€62.5","€27.32",159,0.88,"7/5/2026 19:04"
365,"Fox in a Meadow Wall Art, Printed And Shipped | A402","Shipped Canvas, country farmhouse, large framed canvas, landscape painting, spring decor, spring canvas art, Fox Meadow Wall Art, Spring Meadow Art, Wildflower Art Print, Cottagecore Wall Art, Fox Framed Print, Living Room Art",4453226841,"147","9","2","€62.5","€27.32",159,0.92,"7/5/2026 18:58"
366,"Large Wall Art, Cottage Country Landscape Print, Modern Spring Decor Painting A680","Shipped Canvas, country farmhouse, large framed canvas, neutral oil painting, bedroom prints, spring decor, spring canvas art, Cottage Art, Farmhouse Decor, Living Room Art, Framed Picture Art, Neutral Farmhouse Ar, Living Room Decor",4453237601,"81","4","1","€31.25","€27.32",159,0.51,"7/5/2026 18:47"
367,"Wildflower Meadow Wall Art, Spring & Summer Landscape Print, Farmhouse Spring Decor","country farmhouse, large framed canvas, bedroom prints, spring decor, spring canvas art, Wildflower Meadow, Spring Floral Art, Cottagecore Wall Art, Wildflower Canvas, Mantel Floral Print, Muted Botanical Art, Wildflower Wall Art, Floral Print",4453249918,"104","3","1","€31.25","€27.32",159,0.65,"7/5/2026 18:41"
368,"Christmas Frame TV Art Set, Farmhouse Winter, Holiday Arts, Christmas Decor, Vintage Winter Arts, TV Bundle, Samsung Frame TV Art Set | TS17","Samsung Frame TV, Digital Art set, Frame TV File, Frame TV art, Samsung Art Download, Frame TV Art Set, neutral christmas, Frame Tv Christmas, Christmas TV Art set, christmas, country christmas, winter frame tv, Winer Tv art",1590906401,"3,894","124","97","€1,426.87","€12.86",1000,3.89,"7/5/2026 12:51"
369,"Vintage Spring Meadow Painting, Antique Cottage Decor, Wildflower Print, Spring Farmhouse, Flowers Field Landscape, Downloadable Print A185","meadow painting, wildflower painting, spring landscape, vintage art prints, farmhouse wall decor, art print, flower landscape, vintage prints, country landscape, spring wall artwork, wildflower print, art digital download, spring art print",1667046477,"1,241","57","41","€336.61","€7.18",899,1.38,"7/5/2026 09:51"
370,"4th of July Samsung Frame TV Art, Fireworks Art for TV, Patriotic Red, White, and Blue Art, USA Independence Day Art, American Flag | TV430","digital download, samsung frame tv art, the frame tv art, Frame Tv Art, Vintage Painting, antiquewhiteart, 4th of July Art, Independence Day, Patriotic Frame TV, America Frame TV Art, July 4th Wall Decor, Patriotic Decor, USA Frame TV Art",1732453409,"3,826","206","126","€747.18","€5.18",789,4.85,"7/5/2026 06:26"
371,"Vintage Coastal Samsung Frame TV Art, Neutral Sailboat Seascape, Lake House Frame TV Art, Antique Painting for TV, Digital Download | TV383","Frame TV Art Vintage, Farmhouse Decor, Coastal Frame TV, Summer Frame TV, Neutral TV art, landscape painting, neutral landscape, Sailboat Painting, Lake House Decor, Seaside TV Art, Nautical Frame TV, Moody Summer TV Art, Lake Painting",1713582857,"233","9","7","€41.51","€5.18",823,0.28,"7/5/2026 01:04"
372,"Vintage Snowy Winter Frame TV Art, Farmhouse Winter Landscape Art for Tv, Christmas Art, Digital Download, The Frame Tv Art | TV134","digital download, farmhouse christmas, farmhouse decor, frame tv art set, samsung frame tv art, the frame tv art, winter tv art, antiquewhiteart, winter frame tv, Vintage winter art, snowy winter art, vintage landscape, antique winter art",1559889246,"254","22","8","€47.44","€5.18",1024,0.25,"7/5/2026 00:11"
373,"American Flag Frame TV Art, Vintage 4th of July Art,  Independence Day Frame TV Art, Patriotic USA Painting, Americana Digital Print | TV638","Samsung Frame TV Art, Independence Day, Frame TV Art, 4th of July Art, American Flag, USA Oil Painting, 4th of July Frame TV, Patriotic Frame TV, July 4th, America Frame TV, Patriotic Art, Vintage flag art, antiquewhiteart",4301214239,"766","46","25","€148.25","€5.18",435,1.76,"7/4/2026 18:36"
374,"Swan Lake, Samsung Frame TV Art, Vintage Moody Painting, Antique Dark TV Art, Autumn Landscape, Fall Frame TV Art, Digital Download | TV936","Cottagecore decor, antique swan art, antique white art, classic frame tv art, swan frame tv art, swan lake decor, swan lake painting, swan lake tv art, swan painting tv art, vintage frame tv art, moody frame tv art, moody fall painting, samsung frame tv",4436092288,"130","13","4","€32.6","€7.12",190,0.68,"7/4/2026 17:51"
375,"Vintage Halloween Frame TV Art, Spooky Fall Street Scene, Jack-o’-Lantern Town Painting, Autumn Decor, Moody TV Art, Digital Download |TV679","Spooky Frame TV, halloween tv art, frame tv art, spooky town art, fall tv decor, vintage halloween, jackolantern art, antiquewhiteart, halloween download, haunted street art, digital tv art, moody fall decor, halloween decor",4344586540,"248","18","8","€47.44","€5.18",348,0.71,"7/4/2026 17:45"
376,"Independence Day Frame TV Art Set, 4th of July Art, American Flag, Coastal Summer Garden Art for TV, USA Oil Painting, Digital Download TS52","Samsung Frame TV Art, Farmhouse Decor, Cottage Garden Decor, Coastal Frame TV, Summer Frame TV, Painting for TV, Independence Day, Frame TV Art, 4th of July Art, American Flag, Coastal Garden, USA Oil Painting, 4th of July Frame TV",1738179061,"3,359","104","84","€949.2","€9.88",778,4.32,"7/4/2026 16:48"
377,"Vintage Santa Claus Print, PRINTABLE Christmas Wall Art, Reindeer Painting, Christmas Printable, Holiday Decor, Winter Forest Painting W110","Christmas Printable, Christmas Prints, Raindeer Print, Digital Prints, Santa Claus Print, Holiday Prints, Christmas Wall Art, Santa Claus Painting, Printable Wall Art, Vintage Christmas, Christmas Painting, Christmas Decor, AntiqueWhiteArt",1797336266,"7,168","434","237","€1,782.24","€6.57",635,11.29,"7/4/2026 14:33"
378,"Printable Panoramic Print, Wildflower Field Landscape Vintage Painting, Horizontal Landscape Art, Country Wall Art, Digital Download | A86","Printable Wall Art, Vintage Painting, Vintage Landscape, Wildflower Print, Vintage Art Print, Downloadable Print, Bedroom Art Print, Farmhouse Print, Cottage Art Print, Warm Tone Print, Horizontal Wall Art, Panoramic Painting, Above Bed Art",1655494299,"2,065","104","68","€567.12","€7.29",915,2.26,"7/4/2026 08:50"
379,"Flowers Samsung Frame TV Art, Dark Rustic Floral Art for TV, Muted Roses Painting, Vintage Botanical Screensaver, Digital Download | TV331","Frame TV Art Vintage, Samsung Frame TV Art, Muted Tonal Frame TV, Digital Floral Art, Roses TV Art, Abstract Flowers, Antique Floral Art, Botanical Painting, Flower Frame TV Art, Frame TV Art, Dark Screensaver, Vintage Frame TV, White Floral Artwork",1700390483,"276","19","9","€73.35","€7.12",845,0.33,"7/4/2026 06:30"
380,"Printable American Flag Wall Art, Vintage 4th of July Print, Independence Day Painting, Patriotic Americana Wall Decor, Digital Print | A439","Independence art, Vintage flag art, Patriotic wall art, Rustic flag decor, Classic USA flag, Digital flag print, 4th of July decor, American flag art, Antique flag print, USA flag print, Antiquewhiteart, Americana art, Americana printable",4299413741,"3,044","205","100","€574","€5.02",439,6.93,"7/3/2026 21:59"
381,"Samsung Frame TV Art, Coastal Roses Garden, American Flag, Summer Wildflowers Art for TV, Country USA Oil Painting, 4th of July Art | TV408","Frame TV Art Vintage, Samsung Frame TV Art, Country Frame TV art, Cottage Country, Farmhouse Decor, Cottage Painting, Cottage Garden Decor, Coastal Frame TV, Summer Frame TV, Frame TV Art Summer, Painting for TV, Sailboat Print, Nautical Art",1727651891,"891","44","29","€171.97","€5.18",798,1.12,"7/3/2026 20:37"
382,"4th of July Frame TV Art, Independence Day Art for TV, Patriotic Frame TV Art, American Flag, Wildflower Field Oil Painting | TV650","samsung frame tv art, the frame tv art, Frame Tv Art, Vintage Painting, antiquewhiteart, 4th of July Art, Independence Day, Patriotic Frame TV, America Frame TV Art, July 4th Wall Decor, Patriotic Decor, USA Frame TV Art, Americana Decor",4321062344,"114","7","3","€17.79","€5.18",394,0.29,"7/3/2026 20:37"
383,"Easter Ducklings Printable Wall Art, Cute Baby Duck Art, Easter Decor, Antique Animal Print, Spring Vintage Painting, Instant Download |A199","easter printable, vintage easter print, printable art easter, printable spring, Easter decor, vintage ducks print, classy easter print, vintage easter art, spring easter print, antique animal print, Ducklings Art, ducks printable art, cute easter art",1683954041,"727","57","24","€197.04","€7.18",872,0.83,"7/3/2026 14:51"
384,"Easter Bunnies Printable Wall Art, Classy Easter Decor Print, Antique Moody Rabbit Animal Painting, Vintage Painting, Instant Download |A138","bunny artwork print, vintage easter print, classy easter print, easter printable art, vintage bunny print, antique bunny print, easter printable, spring rabbit decor, bunny printable art, vintage rabbit print, vintage easter art, spring easter print, antique animal print",1630760510,"3,554","219","117","€960.57","€7.18",930,3.82,"7/3/2026 04:51"
385,"Samsung Frame TV Art, Cottage Garden Painting, Muted Tonal Painting, Farmhouse Country Frame TV Art, Summer TV Art Digital Download | TV605","Samsung Frame TV Art, Muted Tonal Frame TV, Country Frame TV art, Cottage Country, Farmhouse Decor, Landscape Painting, AntiqueWhiteArt, Painting TV, Summer Frame TV Art, Cottage Garden, Summer TV Art, Digital Download, Cottagecore TV Art",1903667201,"1,800","161","59","€345.74","€5.12",455,3.96,"7/3/2026 00:15"
386,"Samsung Frame TV Art, Spring Wildflower Field, Flower Meadow, Warm Tone Landscape, Country Painting, Digital Download Frame TV Art | TV36","Frame TV Art Spring, Frame TV Art Vintage, Samsung Frame TV Art, Spring Frame TV Art, Muted Tonal Frame TV, Wildflower Field, Country Frame TV art, Digital Floral Art, Cottage Country, Muted Tonal Art, Warm Tone Painting, Farmhouse Decor, Living TV art",1471349509,"2,778","114","91","€741.65","€7.12",1173,2.37,"7/2/2026 23:57"
387,"Frame TV Ghosts Story: Spooky Halloween Journey Beyond Haunted House Walls, Frame TV Art, Cute Ghosts Painting, Unique Halloween Decor TV159","Frame TV Halloween, neutral halloween, Frame TV Art Vintage, Samsung Frame TV Art, vintage landscape, Autumn frame tv art, Samsung Frame TV, ghost wall art, ghosts wall decor, unique halloween art, Samsung art download, halloween wall decor, frame tv slideshow",1565077636,"4,666","204","154","€1,395.24","€7.92",1017,4.59,"7/2/2026 16:51"
388,"Halloween Frame TV Art, Vintage Haunted House Frame TV, Spooky Street with Pumpkins Painting, Spooky Halloween Samsung Frame TV Art | TV525","halloween art for Tv, antiquewhiteart, frame tv halloween, vintage halloween tv, Digital TV Frame Art, Halloween Download, Halloween Frame TV, Halloween TV Art, Haunted House TV Art, Pumpkin Frame TV Art, Samsung Frame TV, Spooky Frame TV, Vintage Halloween",1794599630,"1,261","109","41","€243.13","€5.18",640,1.97,"7/2/2026 03:31"
389,"Frame TV Art, Americana Wildflowers, Impressionist Summer Screensaver | TV955","Frame TV Art, Samsung Frame TV Art, The Frame TV Art, Summer Frame TV, Americana Frame TV, 4th Of July, Antiquewhiteart, Patriotic TV Art, Wildflower TV Art, Impressionist Art, Living Room TV, Seasonal TV Art, Floral Frame TV",4511629498,"28","0","0","€0","€5.18",49,0.57,"7/2/2026 01:39"
390,"Fall Painting Frame TV Art, Fall Landscape Samsung TV Art, Autumn Oil Painting, Famhouse Art for Frame Tv, Country Fall Screensaver | TV477","Samsung Frame TV Art, Landscape Painting, Fall Frame TV Art, Fall TV Art, Vintage Oil Painting, Landscape Frame TV, Moody Fall Wall Art, Rustic Fall TV Art, Fall Screensaver, Thanksgiving TV Art, Living TV Art, AntiqueWhiteArt, Country Painting",1783551376,"905","59","29","€163.56","€4.93",662,1.37,"7/1/2026 23:53"
391,"Vintage Street Frame TV, Cozy Fall Painting, Halloween Frame Tv Art, Thanksgiving TV Art, Samsung Frame TV Art, Digital Download | TV522","halloween art for Tv, antiquewhiteart, frame tv halloween, vintage halloween tv, Digital TV Frame Art, Downloadable Art, Halloween Download, Halloween TV Art, Pumpkin Frame TV Art, Samsung Frame TV, Spooky Frame TV, Thanksgiving TV Art, Vintage Fall Art",1794104142,"457","18","15","€84.6","€4.93",641,0.71,"7/1/2026 23:53"
392,"Fall Farmhouse Landscape Frame TV Art, Rustic Country Art Painting for TV, Vintage Style Fall Decor, Modern Farmhouse Screensaver | TV466","fall frame tv art, fall tv art, vintage oil painting, Landscape frame tv, fall screensaver, halloween decor, Thanksgiving Tv Art, rustic fall tv art, AntiqueWhiteArt, Rustic Fall Art, moody fall wall art, moody vintage art, country farmhouse",1774958788,"229","19","7","€41.51","€5.18",678,0.34,"7/1/2026 23:53"
393,"PRINTABLE Christmas Wall Art, Christmas Town Painting, Christmas Tree Print, Holiday Decor, Christmas Village Art, Digital Christmas | W142","Christmas decor, printable wall art, antiquewhiteart, Town Print, Christmas Print, Prints Christmas, Digital Prints, vintage christmas, Holiday Decor, Christmas prints, christmas printable, christmas wall art, Christmas Town",1820336357,"588","64","19","€142.88","€6.57",617,0.95,"7/1/2026 23:04"
394,"Printable Rustic Christmas Town Print, Christmas Tree Painting, Moody Winter Wall Art, Farmhouse Christmas Decor, Digital Download | W143","printable wall art, vintage wall art, digital art print, farmhouse decor, christmas decor, christmas wall art, digital prints, downloadable prints, Christmas Printable, Christmas Tree Print, Holiday Wall Decor, Moody Wall Art, Winter Wall Art",1811759462,"2,190","196","72","€541.44","€6.57",607,3.61,"7/1/2026 23:04"
395,"Samsung Frame TV Art, Tropical Summer, Ocean Waves Painting, Abstract Seascape, Beach Art For Frame Tv, Instant Digital Download | TV326","Summer Frame TV Art, Ocean Waves, Samsung Frame TV Art, Ocean TV Art, Digital Download, Downloadable Art, Art for Frame TV, Beach House, Beach Painting, Coastal Summer, Instant Download, Modern Minimalist, Summer Art",1685089776,"285","24","9","€53.37","€5.18",847,0.34,"7/1/2026 21:42"
396,"Samsung Frame TV Art: Misty River Landscape, Vintage Style, Digital Download | TV946","Frame TV Art, Samsung Frame TV Art, The Frame TV Art, Vintage TV Art, Muted TV Art, Living Room TV, Antiquewhiteart, Autumn Frame TV, Fall TV Art, Farmhouse TV Decor, Cozy TV Art, Landscape Painting, Seasonal TV Art",4511630465,"47","1","1","€5.93","€5.18",49,0.96,"7/1/2026 19:39"
397,"Halloween Frame TV Art, Black Cat Art for Frame TV,  Dark Classic Halloween Downloadable Art,  Halloween Samsung Frame TV Art | TV156","Frame TV Halloween, Samsung Art Download, Samsung Frame TV, antiquewhiteart, halloween frame tv, halloween tv art, samsung tv halloween, vintage halloween tv, TV screensaver, art download, art for frame tv, black cat, classic halloween",1564411526,"3,266","237","108","€640.44","€5.18",1018,3.21,"7/1/2026 19:11"
398,"Halloween Frame TV Art, Witch Over Foggy Town, Vintage Moody Painting, Witchy Gothic Decor, Halloween Digital Download | TV737","Halloween Frame TV, Witchy TV Art, Spooky TV Art, Moonlit Night, Vintage Halloween, Antiquewhiteart, Samsung Frame TV Art, The Frame TV Art, Seasonal TV Art, Living Room TV, Muted TV Art, Neutral Halloween, Witch Frame TV",4353832707,"285","22","9","€53.37","€5.18",331,0.86,"7/1/2026 19:11"
399,"Spooky Candles Still Life TV Art: Vintage Fall Decor (Digital Download) TV790","Frame TV Art, Samsung Frame TV Art, The Frame TV Art, TV Art Digital, Vintage TV Art, Farmhouse TV Decor, Antiquewhiteart, Halloween Frame TV, Spooky TV Art, Gothic TV Art, Candle Still Life, Wall Art For TV, Neutral Halloween",4373209378,"50","5","1","€5.93","€5.18",297,0.17,"7/1/2026 19:11"
400,"Frame TV Art, Halloween Spooky Dark Art, Haunted House, Ghostly Digital Art for TV, Oil Painting, Moody Neutral Eerie Frame TV Arts | TV177","Frame TV Halloween, Samsung Art Download, Samsung Frame TV, antiquewhiteart, frame tv spooky, halloween frame tv, halloween tv art, samsung tv halloween, spooky tv art, vintage halloween tv, frame tv art eerie, frame tv haunted, spooky landscape",1569799366,"408","25","13","€73.32","€4.93",1010,0.4,"7/1/2026 19:11"
401,"New Year's Frame TV Art:  Fireworks Painting, Vintage Vibe | WA163","Frame TV Art, Warm Glow Art, Vintage Vibe, Antiquewhiteart, Farmhouse TV Decor, Cozy Living Room Art, New Years Frame TV, Year end Party, digital download, samsung frame tv art, New year Screensaver, Fireworks Art, New Year Art",4429018867,"74","10","2","€11.86","€5.18",204,0.36,"7/1/2026 19:11"
402,"Halloween Frame TV Art: Spooky Pumpkin Market Scene (Digital Download) TV800","Frame TV Art, Samsung Frame TV Art, The Frame TV Art, Halloween Frame TV, Pumpkins TV Art, Spooky TV Art, Antiquewhiteart, Vintage Halloween, Farmhouse TV Decor, Seasonal TV Art, Witchy TV Art, TV Art Digital, Eerie Scene",4373218243,"82","3","2","€11.86","€5.18",297,0.28,"7/1/2026 19:11"
403,"Halloween Frame TV Art Vintage Spooky, Ghostly Digital Art for TV, Haunted House Oil Painting, Moody Neutral Eerie Frame TV Arts | TV150","Frame TV Halloween, Samsung Art Download, Samsung Frame TV, antiquewhiteart, frame tv spooky, halloween frame tv, halloween tv art, samsung tv halloween, spooky tv art, vintage halloween tv, frame tv art eerie, frame tv haunted, spooky landscape",1564397946,"627","34","20","€112.8","€4.93",1018,0.62,"7/1/2026 19:11"
404,"Haunted Mansion Halloween Art for Samsung Frame TV (Digital Download)","Frame TV Art, Samsung Frame TV Art, The Frame TV Art, Halloween Frame TV, Spooky TV Art, Antiquewhiteart, Pumpkins TV Art, Haunted House Art, Vintage TV Art, Seasonal TV Art, Dark Forest, Spooky Scene, Halloween Scene",4353835455,"27","0","0","€0","€5.18",331,0.08,"7/1/2026 19:11"
405,"Halloween Frame TV Art, Frame TV Art File, Ghost Art, Halloween Ghost Decor, Neutral Halloween, Spooky Art for Tv, Vintage Painting |TV79","Digital Art, Frame TV File, Frame TV Halloween, Frame TV art, Samsung Art Download, Samsung Frame TV, black and white, ghost art print, ghost wall art, ghost wall decor, neutral halloween, vintage drawing, antiquewhiteart",1542375368,"8,710","400","288","€1,707.84","€5.18",1048,8.31,"7/1/2026 19:11"
406,"Samsung Frame TV Art, Autumn Cottages by the Creek with Pumpkins, Vintage Fall Landscape, Digital Download, warm earth tones TV710","frame tv art, samsung frame tv art, the frame tv art, fall tv art, autumn frame tv, rustic fall, antiquewhiteart, pumpkins tv art, vintage tv art, cozy tones, farmhouse tv decor, nature tv art, seasonal tv art",4350106878,"90","9","2","€11.86","€5.18",337,0.27,"7/1/2026 19:11"
407,"Vintage Halloween Ghost Print, Dark Witchy Wall Art (Digital Download) | A861","Halloween Decor, Digital Art Prints, Ghost Print, Halloween Printable, Digital Download, Halloween Print, Antiquewhiteart, Spooky Prints, Ghost Wall Art, Printable Art, Cottage Core Art, Dark Academia, Moody Ghost Print",4525634222,"37","0","1","€6.64","€5.8",23,1.61,"7/1/2026 02:05"
408,"Vintage Christmas Frame TV Art Set: Moody Holiday Digital Download TS90","Samsung Frame TV, Frame TV art, Frame TV Art Set, Digital Art set, antiquewhiteart, christmas tv art, digital download, holiday tv art set, seasonal tv art, tv art bundle, tv art for winter, winter tv art, Christmas Bundle",4394932904,"3,895","96","62","€1,990.82","€28.07",259,15.04,"7/1/2026 01:38"
409,"Moody Floral Wall Art Print, Dark Hydrangea Botanical Painting (Digital Download) | A852","moody floral print, printable wall art, antiquewhiteart, Moody vintage print, Digital Download, flower wall art, farmhouse wall decor, french country decor, flower painting, dark aesthetic print, botanical wall art, thanksgiving art, hydrangea Painting",4525599154,"26","3","0","€0","€6.02",23,1.13,"7/1/2026 01:03"
410,"Navy Flowers Samsung Frame TV Art, Blue Wildflower Field, Cool Tone Wildflowers Art, Moody Country Flowers Art, Digital Download| TV387","Frame TV Art Spring, Frame TV Art Vintage, Samsung Frame TV Art, Spring Frame TV Art, Muted Tonal Frame TV, Wildflower Field, Country Frame TV art, Digital Floral Art, Cottage Country, Muted Tonal Art, Cool Tone Painting, Navy Flowers, Navy Flowers TV Art",1701329374,"1,334","101","44","€358.6","€7.12",820,1.63,"6/30/2026 21:54"
411,"Cottage in a Fall Forest: Vintage Landscape Painting, Farmhouse Autumn Print (Digital Download) A846","digital art print, printable wall art, antiquewhiteart, fall prints, digital prints, autumn art print, autumn landscape, moody landscape, rustic art print, vintage landscape, thanksgiving print, vintage printable, Cottage Painting",4525562328,"33","0","1","€7.17","€6.27",23,1.43,"6/30/2026 21:41"
412,"Samsung Frame TV Art, Summer Scenery Screensaver, Vintage Country Field Landscape, Clouds Painting,   Farmhouse Decor Digital Download TV397","Samsung Frame TV Art, Landscape TV Art, Abstract Landscape, Modern Scenery, Spring Screensaver, Summer Country Art, Landscape Painting, Vintage Frame TV, Frame TV Art, Samsung Frame TV, Summer Frame TV, Spring TV Art, Farmhouse Decor",1717317221,"285","15","9","€51.21","€4.97",817,0.35,"6/30/2026 20:38"
413,"Funny Bathroom Halloween Wall Art: Hedgehog Print, Halloween Decor (Instant Download) | A863","Funny wall art, bathroom wall decor, bathroom decor, funny bathroom art, bathroom wall art, toilet wall art, hedgehog art print, sketch, printable wall art, vintage wall art, cottagecore decor, antiquewhiteart, fall bathroom decor",4525635803,"22","0","0","€0","€6.27",23,0.96,"6/30/2026 09:02"
414,"Printable Spooky Halloween Gallery Set of 8, Dark & Moody Ghost Wall Art, Vintage Fall Painting, Rustic Farmhouse Autumn Digital Prints S119","spooky wall art, halloween print, ghost art print, dark fall decor, moody wall art, autumn wall set, vintage halloween, printable fall art, farmhouse halloween, halloween gallery, antiquewhiteart, fall digital print, rustic ghost art",4336111002,"321","12","6","€121.02","€17.63",364,0.88,"6/30/2026 06:35"
