"#","LISTING","TAGS","LISTING ID","TOTAL VIEWS","FAVORITES","EST. SALES","EST. REVENUE","PRICE","LISTING AGE","DAILY VIEWS","LAST UPDATED"
124,"Vintage Forest Sketch, Black and White Nature Digital Print, Neutral Tree Drawing, Antique Wildlife Wall Art, Warm Aesthetic Decor | A102","antique sketch print, vintage sketch set, sketch wall art, neutral landscape, country farmhouse, pine trees drawing, printable wall art, digital download, forest sketch, forest digital print, Black and white art, rustic forest art, vintage pine tree",1425130305,"4,281","318","141","€1,010.97","€6.27",1236,3.46,"7/10/2026 06:12"
125,"Summer Ocean Painting Frame TV Art, Soft Toned Ocean Waves, Neutral Minimalist Seascape, Beach House Decor, Instant Digital Download | TV325","Summer Frame TV Art, Samsung Frame TV Art, Ocean TV Art, Digital Download, Downloadable Art, Art for Frame TV, Beach House, Beach Painting, Coastal Summer, Instant Download, Modern Minimalist, Summer Art, Summer Art for TV",1699272971,"338","20","11","€65.23","€5.18",847,0.4,"7/10/2026 06:11"
126,"Printable Halloween Laundry & Bathroom Wall Art Set of 6, Fun Ghost Prints, Bathroom Decor, Spooky Fall Gallery Downloadable Art | S126","halloween wall art, ghost prints, fall farmhouse decor, spooky bathroom art, laundry room prints, autumn ghost art, printable wall decor, spooky gallery wall, antique white art, ghost wall decor, fall seasonal art, halloween bathroom, moody printable set",4345821481,"2,163","105","54","€636.66","€10.31",345,6.27,"7/10/2026 04:09"
127,"Samsung Frame TV Art Set of 30, Spring & Summer Art, Vintage Farmhouse Painting, Country Landscape, TV Art Bundle, Digital Download | TS42","Frame TV Art Vintage, Samsung Frame TV Art, Cottage Country, Muted Tonal Art, Warm Tone Painting, Farmhouse Decor, Living TV art, Farmhouse Frame TV, Frame TV Set, Country TV arts, Frame TV Bundle, Spring Frame Tv, Wildflower TV Art",1663997049,"15,499","418","291","€7,883.19","€23.68",903,17.16,"7/10/2026 02:13"
128,"Printable Wildflower Wall Art, Moody Painting, Floral Art | Digital Download | A666","Printable Wall Art, Vintage Painting, Wildflower Print, Vintage Art Print, Downloadable Print, Farmhouse Print, Antiquewhiteart, country wall decor, rustic wall art, cottagecore print, Floral Art Print, Moody Floral, Wild Flowers Art",4434921522,"59","4","1","€7.17","€6.27",192,0.31,"7/10/2026 02:03"
129,"Large Wall Art, Tulip Field Landscape Print, Modern Spring Decor Painting","Printed and Shipped, Shipped Canvas, Large Size Canvas, country farmhouse, large framed canvas, modern living room, nature landscape art, neutral oil painting, landscape painting, bedroom prints, spring decor, spring canvas art, Floral Painting",4435600514,"1,366","131","21","€656.25","€27.32",191,7.15,"7/10/2026 01:58"
130,"Printable Set of 6 Prints, Vintage Dark Landscape, Gallery Wall Botanical Drawings, Moody Brown Country Scenery, Neutral Wall Prints | S120","Printable Wall Art, Digital Prints, Downloadable Prints, Country Landscape, Dark Landscape, Fall Decor, Landscape Painting, Muted Landscape, Neutral Wall Prints, Botanical Drawing, Moody Wall Art, Vintage Prints, Gallery Wall Art",4336718778,"3,410","244","85","€1,220.6","€12.55",363,9.39,"7/10/2026 01:12"
131,"Samsung Frame TV Art, Flower Field, Vintage Oil Painting, Cottagecore Wall Art Decor, Farmhouse Frame TV Art, Digital Download | TV246","Frame TV Art Vintage, Samsung Frame TV Art, Spring Frame TV Art, Country Frame TV art, Cottage Country, Muted Tonal Art, Farmhouse Decor, Forest Cottage Decor, Landscape Painting, Spring Landscape, Spring Painting, Wildflower art, flowers field print",1648562483,"588","15","19","€154.85","€7.12",925,0.64,"7/10/2026 01:01"
132,"Swans in Love Frame TV Art, Valentine's Day Vintage Painting (Digital Download) TV555","Tv Valentine's day, digital download, frame tv art, frame tv love art, frame tv valentine, frame tv valentines, samsung frame tv, Romantic Frame TV, valentines frame art, Romantic Home Decor, AntiqueWhiteArt, Valentine's Day Art, Vintage Frame TV Art",1856589009,"2,452","234","81","€660.15","€7.12",550,4.46,"7/10/2026 00:02"
133,"Winter Frame TV Art, Baby Deer in Snowy Winter Landscape, Christmas Frame Tv Art, Winter Forest, Holiday Painting, Digital Download | WA76","country christmas, digital download, farmhouse christmas, samsung frame tv art, the frame tv art, winter tv art, Vintage Winter, Winter Painting, Frame Tv Art, Deer Frame Tv, Deer Art, Vintage Frame TV, Christmas Frame TV",1818551111,"584","49","19","€112.67","€5.18",621,0.94,"7/9/2026 23:22"
134,"Printable Wall Art, Neutral Bird Sketch, Vintage Nursery Print, Animal Illustration, Beige Nursery Gallery Wall Art, Digital Download | A468","Printable Wall Art, Digital Download, Bird Wall Art, Neutral Wall Art, Nursery Prints, Vintage Nursery, Animal Illustration, Vintage Wall Art, Beige Wall Art, Antiquewhiteart, Printable Bird Art, Gallery Wall Print, Sketch",4327900677,"660","76","21","€127.89","€5.32",380,1.74,"7/9/2026 21:49"
135,"Winter Cabin Frame TV Art, Vintage Rustic Painting, Landscape Samsung Frame TV Art, Farmhouse Winter Pine Forest Painting, Art for TV | WA44","country christmas, digital download, farmhouse christmas, farmhouse decor, holiday decor, samsung frame tv art, the frame tv art, winter tv art, antiquewhiteart, winter frame tv, moody frame Tv, rustic home decor, seasonal Tv art",1612558930,"548","32","18","€106.74","€5.18",953,0.58,"7/9/2026 20:43"
136,"Set of 6 Printable Wildflower Wall Art, Gallery Set of 6 Antique Wall Art Prints, Vintage Farmhouse Landscape Downloadable Art Print | S33","Printable Wall Art, Vintage Landscape, Wildflower Print, Vintage Art Print, Downloadable Print, Bedroom Art Print, Farmhouse Print, Cottage Art Print, Nature Painting, Digital Print Art, Wildflower Field Set, Printable Gallery, Gallery Art Print",1468530635,"32,327","1,759","1,070","€8,816.8","€7.2",1177,27.47,"7/9/2026 19:55"
137,"Printable Vintage Halloween Wall Art, Warm-Toned Fall Prints, Ghosts in a Garden Digital Download, Spooky Wall Art, Autumn Home Decor | A563","halloween Wall Art, Printable Wall art, spooky fall decor, antiquewhiteart, halloween printable, fall wall art, digital download, vintage fall art, warm tone print, printable halloween, ghost artwork, autumn landscape, spooky prints",4344980585,"109","11","3","€23.13","€6.74",347,0.31,"7/9/2026 18:26"
138,"Printable Butterfly Painting, Pink Cottagecore Wall Art, French Country Decor, Shabby Chic Girls Room Print, Romantic Nursery Artwork| A578","floral nursery art, girls nursery art, french cottage art, pink butterfly art, cottagecore print, cottagecore decor, shabby chic art, antique white art, french country art, romantic wall art, girls room decor, nursery wall art, digital download",4348111081,"1,581","211","52","€316.68","€5.32",341,4.64,"7/9/2026 17:48"
139,"Printable Santa Claus Christmas Wall Art, Vintage Winter Print,  Farmhouse Christmas Decor, Christmas Oil Painting, Cottagecore Prints | W24","printable wall art, vintage wall art, digital art print, farmhouse decor, fine art, Santa Claus print, christmas decor, christmas decoration, christmas wall art, cottagecore decor, digital prints, downloadable prints, seasonal decor",1582664544,"2,043","105","67","€503.84","€6.57",992,2.06,"7/9/2026 17:21"
140,"Fun Halloween Wall Art, Ghost with Popcorn, Dark Halloween Painting, Funny Ghost Art, Haunted Halloween Decor, Halloween Quirky Prints A343","Ghost Painting, Halloween Decor, Antiquewhiteart, Cute Ghost Art, Ghost Wall Art, Digital Printable, Fun Halloween Art, Instant Download, Halloween Art, Spooky Print, Fun Halloween Print, Kitchen Decor, Fun Halloween Decor",1782356910,"363","38","12","€86.04","€6.27",664,0.55,"7/9/2026 15:19"
141,"Vintage Halloween Print: Black Cat & Jack-o-lanterns (Digital Download) A642","Halloween Wall Art, Jack O Lantern Art, Black Cat Art, Cottage Halloween, Autumn Painting, Vintage Fall Art, Antiquewhiteart, Spooky Decor, Vintage Painting, Printable Wall Art, Pumpkin Wall Art, Vintage Prints, Fall Season Prints",4373216961,"54","5","1","€5.93","€5.18",297,0.18,"7/9/2026 15:19"
142,"Vintage Halloween Print: Little Witches, Autumn Village (Digital Download)","Halloween Wall Art, Witch Print, Pumpkin Village, Autumn Painting, Vintage Painting, Antiquewhiteart, Rustic Halloween, Warm Tones, Moody Halloween, Fall Wall Art, Halloween Art Print, Halloween Digital, Digital Download",4373217599,"34","3","1","€5.93","€5.18",297,0.11,"7/9/2026 15:19"
143,"Halloween Magical Wall Art, Black Print, Floating Candles Rustic Oil Painting, Halloween Downloadable Art, Dark Fall Witchy Print | A507","floating candles art, halloween wall art, antiquewhiteart, witchy wall print, black magic decor, rustic halloween, magical wall art, spooky wall print, candle wall art, halloween download, dark fall decor, printable halloween, gothic wall art",4334405910,"167","27","5","€29.65","€5.18",367,0.46,"7/9/2026 15:19"
144,"Fall Wildflowers Moody Frame TV Art, Fall Landscape Painting for TV, Botanical Fall Screensaver Wildflower Art, Autumn Frame TV Art | TV471","botanical wall art, Frame TV Art Vintage, Samsung Frame TV Art, wildflowers TV art, floral painting TV, antiquewhiteart, moody floral, moody Frame TV art, moody flower Art, Fall Flowers Tv Art, Fall Frame Tv Art, Rustic Frame TV Art, Fall Screensaver",1790263439,"2,353","146","77","€456.61","€5.18",676,3.48,"7/9/2026 15:15"
145,"Easter Print, Bunny in Wildflowers, Moody Vintage Style Spring Decor, Instant Download |A416","easter printable art, spring easter print, Antique White Art, bunny painting, cottage core, cottage decor, country style, digital prints, easter decor, easter painting, Dark Wall Art, Easter Bunny, Moody Print",1863460572,"3,153","261","104","€853.84","€7.18",509,6.19,"7/9/2026 15:08"
146,"Moody Samsung Frame TV Art, Vintage Dark Flower Painting, Dark Academia Botanical TV Art, Floral Art for TV, Digital Download | TV222","Frame TV Art Vintage, Samsung Frame TV Art, Victorian Frame Tv, antique Painting, cottage decor, dark floral painting, dark flower TV art, dark Frame TV Art, moody floral, moody Frame TV art, dark academia TV art, moody flower Art, antiquewhiteart",1576741112,"1,911","154","63","€373.59","€5.18",1000,1.91,"7/9/2026 13:54"
147,"Halloween Frame TV Art, Cute Ghost At Haunted House, Vintage Spooky Fall Art For Samsung The Frame, Digital Download, Moody Dark Tones TV720","Frame TV Art, Samsung Frame TV Art, The Frame TV Art, Halloween Frame TV, Ghost Frame TV Art, Spooky TV Art, Antiquewhiteart, Pumpkins TV Art, Vintage Halloween, Seasonal TV Art, Spooky Frame TV Art, Haunted House, Rustic Painting",4353833261,"444","24","14","€83.02","€5.18",331,1.34,"7/9/2026 01:01"
148,"Samsung Frame TV Art, Library Books Frame TV, Still Life with Books, Rustic Vintage Oil Painting, Dark Bookish Art, Digital Download | TV369","digital download, farmhouse decor, frame tv art set, samsung frame tv art, the frame tv art, antiquewhiteart, vintage Frame Tv art, Library Frame TV Art, Vintage Style Art, Books Frame TV Art, Textured Painting, Frame TV Pictures, TV Art Download",1690585150,"389","29","12","€71.16","€5.18",838,0.46,"7/9/2026 00:25"
149,"Printable Vintage Drawing of a Cottage, Dark Academia Landscape, Botanical Digital Prints, Moody Country Scenery, Neutral Wall Art | A530","vintage cottage art, moody wall print, black white print, cottagecore decor, dark landscape art, neutral wall art, printable cottage, rustic home decor, vintage scenery, antiquewhiteart, country wall art, botanical sketch, cottage drawing",4338493780,"326","30","10","€71.7","€6.27",359,0.91,"7/8/2026 23:58"
150,"Printable Set of Two Vintage Swan Lake Wall Art, Fall Moody Landscape Painting, Antique Dark Farmhouse Wall Decor, Digital Download | S136","Printable Wall art, antiquewhiteart, fall wall art, digital download, vintage fall art, warm tone print, swan painting, moody fall decor, vintage prints, moody farmhouse, dark academia prints, Set of two, Print Set",4359411496,"849","98","21","€232.89","€9.69",321,2.64,"7/8/2026 23:39"
151,"HAND-DRAWN 50+ Vintage Ghost Halloween Printable Wall Art Bundle (Digital Download) | S204","printable wall art, mega bundle prints, digital download, no ai artwork, cute ghost art, antiquewhiteart, antique white art, halloween printable, ghost wall art, fall printable art, vintage halloween, nursery prints, farmhouse decor",4519852110,"133","2","2","€42.14","€18.42",34,3.91,"7/8/2026 23:04"
152,"Cute Ghost Halloween Laundry Room Wall Art, Printable Vintage Farmhouse Decor, Spooky Ghost, Linen Line Download, Halloween Ghost Print A547","halloween wall art, antiquewhiteart, cute ghost print, laundry room art, farmhouse halloween, vintage halloween, halloween print, ghost halloween art, spooky cute art, linen line art, halloween download, printable wall art, halloween decor",4340290594,"854","72","28","€191.24","€5.97",356,2.4,"7/8/2026 22:06"
153,"Summer Frame TV Art, Neutral Floral Screensaver: Wildflowers Art, Digital Download TV944","Frame TV Art Spring, Muted Tonal Frame TV, Country Frame TV Art, Wildflower Frame TV, Floral Frame TV Art, Digital Floral Art, Cottage Country, Samsung Frame TV Art, Frame TV Art Flowers, Wildflower Field, Neutral Tone Art, Frame TV, TV Floral Art",4477465337,"118","4","3","€24.45","€7.12",111,1.06,"7/8/2026 21:20"
154,"Easter Bunny with Carrot Oil Painting Frame TV Art, Easter Decor (Digital Download) TV945","Samsung Frame TV Art, Digital Download, Easter TV Art, Easter Frame TV Art, TV Art Nursery, Spring Frame TV Art, Easter Decor, Happy Easter Art, Frame TV Artwork, Easter Bunny Art, Frame TV Wallpaper, Easter Art Frame TV, AntiqueWhiteArt",4477474022,"113","9","3","€24.45","€7.12",111,1.02,"7/8/2026 21:20"
155,"Abstract Frame TV Art, Minimalist Oil Painting, Modern Art for Samsung Frame TV, Neutral Tones, Textured Painting,  Digital Download | TV141","Samsung Frame Tv, Digital Download, Abstract Art, Art For Frame Tv, Textured Painting, AntiqueWhiteArt, Frame Tv Art, Abstract Frame Tv, Boho Frame Tv Art, Winter Frame Tv Art, Neutral Winter Art, Minimalist Frame TV, 3D textured Art",1645049808,"946","51","31","€183.83","€5.18",910,1.04,"7/8/2026 19:02"
156,"Printable Country Wall Art, Summer Wildflower Field, Landscape Painting, Farmhouse Decor, Summer Rustic Print, Digital Download | A235","antique art print, country landscape, farmhouse decor, landscape painting, printable wall art, rustic wall decor, summer painting, vintage art print, vintage landscape, vintage oil painting, wildflowers print, wildflower field art, country print",1709449591,"1,471","107","48","€344.16","€6.27",830,1.77,"7/8/2026 17:16"
157,"Vintage Kitchen Print, Dining Room Print, Still Life Apples Painting, Fruit Wall Art, Country Kitchen Decor, PRINTABLE Digital Download A470","kitchen print, printable wall art, vintage art prints, digital art, kitchen still life, still life wall art, kitchen wall art, fruit print, Vintage Wall Art, Kitchen Decor, Vintage Art Download, Antiquewhiteart, Country Kitchen",4327890153,"1,392","179","46","€329.82","€6.27",380,3.66,"7/8/2026 17:05"
158,"Printable Fall Wall Art, Fall Landscape Print, Deer Painting, Neutral Fall Decor, Seasonal Decor, Autumn Wall Art, Digital Download | A469","digital art print, printable wall art, vintage landscape, vintage prints, fall wall art, fall print, antiquewhiteart, neutral fall decor, Muted Autumn Art, Fall Landscape Print, Woodland  Print, Living Room Decor, Printable art",1775425419,"1,463","105","48","€344.16","€6.27",705,2.08,"7/8/2026 08:41"
159,"Antique Rustic Flower Vase Print, White Roses Vintage Painting, Bedroom Print, Living Room Wall Art, Printable Digital Download | A15","white rose painting, cottage core decor, french country art, french vintage print, rustic floral print, spring floral print, still life flowers, vintage oil painting, printable wall art, flower painting, floral painting, flower vase print, rustic moody",1463006453,"297","34","9","€64.53","€6.27",1185,0.25,"7/8/2026 08:01"
160,"Samsung Frame TV Art, Hydrangea Floral Art, Soft Warm Tone Screensaver, Vintage Country Summer Flowers Painting, Digital Download | TV416","Floral Frame TV Art, Frame TV Art Vintage, Digital Floral Art, Samsung Frame TV Art, Frame TV Art Flowers, Summer Frame TV Art, Garden Oil Painting, Samsung Frame TV, Frame TV Art, Hydrangea Painting, Soft Painting for TV, Beige Screensaver, Neutral Frame TV Art",1732464947,"1,676","145","55","€326.15","€5.18",789,2.12,"7/8/2026 06:10"
161,"Summer Coastal Lighthouse Samsung Frame TV Art, 4th of July Decor, Digital Download | TV951","Frame TV Art, Samsung Frame TV Art, The Frame TV Art, Coastal Frame TV, Summer Frame TV, Nautical TV Art, Antiquewhiteart, Lighthouse TV Art, Muted TV Art, Beach House Decor, Seasonal TV Art, 4th of july, independence day",4511630574,"237","11","7","€41.51","€5.18",49,4.84,"7/8/2026 00:44"
162,"Printable Cottage Wall Art, Spring Garden Painting, Digital Download | A755","Downloadable Print, Printable Wall Art, Cottage Garden Decor, Digital Art Print, Landscape Painting, Spring Landscape, Spring Painting, Vintage Art Print, Vintage Landscape, Vintage Wall Art, AntiqueWhiteArt, Countryside Wall Art, Spring Garden Prints",4455802172,"100","9","3","€24.63","€7.18",154,0.65,"7/8/2026 00:41"
163,"Vintage Clouds, Antique Oil Painting, Sky Wall Art, Cloudy Sky, Vintage Sky, French Farmhouse, Neutral Cloud Art, Digital PRINTABLE | A109","Cloud Wall Art, Pastel Sky Print, sky painting, colorful cloud print, printable wall art, Minimalist printable, sky oil painting, Vintage Clouds, French Farmhouse, antique cloud print, nursery cloud print, vintage cloud art, cloud oil painting",1436012961,"733","58","24","€172.08","€6.27",1222,0.6,"7/8/2026 00:02"
164,"Printable Halloween Gallery Set, Cute Ghosts Prints, Fall Painting, Halloween Decor, Farmhouse Gallery Wall Set, Downloadable Prints | S85","cute ghost, farmhouse halloween, gallery wall set, ghost painting, halloween decor, landscape painting, quirky decor, set art print, Gallery Wall Arts, AntiqueWhiteArt, Halloween Prints, Ghost Wall Art, Halloween gallery",1790708619,"21,578","1,273","541","€7,000.54","€11.31",675,31.97,"7/7/2026 20:52"
165,"Printable Reading Ghost Wall Art, Cozy Halloween Print (Digital Download) | A862","Halloween Printable, Digital Download, Antiquewhiteart, Ghost Wall Art, ghost painting, halloween ghost art, cute ghosts, cottagecore, book painting, ghost reading, bookish print, booklover gift, victorian decor",4525628011,"23","1","0","€0","€5.8",23,1,"7/7/2026 20:25"
166,"Independence Day Frame TV Art, American Flag, 4th of July Art, Coastal Garden, Summer Art for TV, USA Oil Painting, Digital Download | TV440","Samsung Frame TV Art, Farmhouse Decor, Cottage Garden Decor, Coastal Frame TV, Summer Frame TV, Painting for TV, Independence Day, Frame TV Art, 4th of July Art, American Flag, Coastal Garden, USA Oil Painting, 4th of July Frame TV",1723177434,"383","15","12","€71.16","€5.18",780,0.49,"7/7/2026 16:41"
167,"Ghosts in Wildflower Field, Fall Spooky Halloween Wall Art, Vintage Autumn Landscape, Spooky Halloween Decor, Autumn Spooky Painting | A155","Wall Art Halloween, halloween Wall Art, Wildflowers Wall art, Halloween Art, Printable Wall art, Wildflower landscape, vintage wildflowers, wildflower art, farmhouse Wall Art, Spooky Halloween, Autumn Wall Print, Spooky Decor, Neutral Halloween",1577133653,"1,510","109","49","€389.06","€6.94",1020,1.48,"7/7/2026 15:59"
168,"Summer Coastal Print, Vintage Farmhouse Wall Art, Muted Beach Art (Digital Download) A823","beach decor, coastal wall art, ocean wall art, sea painting, Antiquewhiteart, cloud print, vintage coastal art, nature wall art, rustic farmhouse art, sky oil painting, summer wall art, digital download",4483195274,"239","15","7","€41.58","€5.19",101,2.37,"7/7/2026 15:11"
169,"LARGE Halloween & Fall Frame TV Art Bundle, Spooky Season Decor, Digital Download |TS111","Samsung Frame TV, ghost Frame tv, Frame TV art, Samsung Art Download, Frame TV Art Set, Halloween TV Art set, Digital Art set, Frame TV File, Frame TV Halloween, antiquewhiteart, spooky frame tv, Halloween Decor, Large Bundle",4517583095,"50","0","0","€0","€28.07",38,1.32,"7/7/2026 14:22"
170,"Halloween Wall Art: Funny Spooky Bathroom Print, Ghost on Toilet (Instant Download) | A856","ghost painting, antiquewhiteart, ghost wall art, instant download, Spooky print, Bathroom Halloween, Halloween Bathroom, Halloween Wall Art, Ghost Bathroom Art, Halloween Prints, Halloween Printable, ghost on toilet art, ghost reading print",4525616102,"36","2","1","€7.17","€6.27",23,1.57,"7/7/2026 14:10"
171,"PRINTED Large Wall Art, Coastal Wildflower Field Painting, Modern Spring & Summer Decor","Printed and Shipped, Shipped Canvas, Large Size Canvas, large framed canvas, modern living room, nature landscape art, neutral oil painting, landscape painting, bedroom prints, spring decor, spring canvas art, Wildflower Field, Coastal Prints",4435592959,"3,113","179","50","€1,562.5","€27.32",191,16.3,"7/7/2026 13:11"
172,"Printable Reading Ghost Wall Art, Cozy Halloween Print (Digital Download) | A858","Halloween Printable, Digital Download, Antiquewhiteart, Ghost Wall Art, ghost painting, halloween ghost art, cute ghosts, cottagecore, book painting, ghost reading, bookish print, booklover gift, victorian decor",4525626168,"15","0","0","€0","€5.8",23,0.65,"7/7/2026 13:08"
173,"Ghost With Toilet Paper, Halloween Wall Art: Funny Bathroom Print (Instant Download) | A859","ghost wall art, funny bathroom art, bathroom ghost print, AntiqueWhiteArt, halloween art print, halloween decor, bathroom wall art, ghost printable art, toilet humor decor, toilet paper art, cute ghost painting, spooky art prints, fun toilet wall art",4525641180,"18","0","0","€0","€6.27",23,0.78,"7/7/2026 13:08"
174,"Moody Vintage Fall Landscape Painting, Farmhouse Autumn Print (Digital Download) A850","digital art print, printable wall art, antiquewhiteart, fall prints, vintage print, digital prints, lake painting, autumn art print, autumn landscape, autumn painting, moody landscape, rustic art print, vintage landscape",4525552402,"32","0","1","€7.17","€6.27",23,1.39,"7/7/2026 13:08"
175,"Printable Muted Wildflowers Wall Art, Muted Vintage Meadow Painting, Rustic Farmhouse Decor| A839","Printable Wall Art, Vintage Painting, Wildflower Print, Vintage Art Print, Downloadable Print, Farmhouse Print, Antiquewhiteart, country wall decor, rustic wall art, fall wall art, autumn decor, cottagecore print, Floral Art Print",4510644190,"17","0","0","€0","€6.27",51,0.33,"7/7/2026 13:08"
176,"Paintable Wildflower Meadow Wall Art, Vintage Moody Painting, Fall Decor | A853","Printable Wall Art, Vintage Painting, Wildflower Print, Vintage Art Print, Downloadable Print, Antiquewhiteart, rustic wall art, fall wall art, cottagecore print, Floral Art Print, Thanksgiving prints, floral painting, Cottage Art print",4525592799,"24","2","0","€0","€6.27",23,1.04,"7/7/2026 13:08"
177,"50+ Halloween & Fall Gallery Bundle, Cottagecore Print Set, Printable Wall Art (Digital Download) | S203","halloween wall art, fall wall art, vintage halloween, printable wall art, halloween decor, fall decor, gallery wall set, ghost wall art, cottagecore decor, vintage print set, dark academia art, instant download, antiquewhiteart",4516630634,"128","3","2","€42.14","€18.42",40,3.2,"7/7/2026 13:07"
178,"50+ Fall & Halloween Printable Wall Art Bundle, Moody Vintage Style (Digital Download) | S205","printable wall art, mega bundle prints, digital download, cute ghost art, antiquewhiteart, halloween printable, ghost wall art, fall printable art, vintage halloween, farmhouse decor, halloween wall art, neutral halloween, fall wall decor",4521037756,"77","3","1","€21.07","€18.42",32,2.41,"7/7/2026 13:06"
179,"Moody Floral Wall Art Print, Dark Academia Botanical Painting (Digital Download) | A851","moody floral print, printable wall art, antiquewhiteart, Moody vintage print, Digital Download, Moody Flower print, flower wall art, farmhouse wall decor, french country decor, flower painting, dark aesthetic print, botanical wall art, thanksgiving art",4525574179,"26","3","0","€0","€6.02",23,1.13,"7/7/2026 13:06"
180,"Vintage Halloween Ghost Print, Black Cat, Witchy Wall Art (Digital Download) | A855","Halloween Decor, Digital Art Prints, Ghost Print, Halloween Printable, Digital Download, Ghosts Art Pint, Halloween Print, Antiquewhiteart, Spooky Prints, Ghost Wall Art, Printable Art, Cute Ghost Decor, Vintage Fall",4525602443,"43","0","1","€6.64","€5.8",23,1.87,"7/7/2026 13:06"
181,"50+ Halloween & Fall Gallery Bundle, Cottagecore Print Set, Printable Wall Art (Digital Download) | S203","halloween wall art, fall wall art, vintage halloween, printable wall art, halloween decor, fall decor, gallery wall set, ghost wall art, cottagecore decor, vintage print set, dark academia art, instant download, antiquewhiteart",4516635747,"129","11","2","€42.14","€18.42",40,3.23,"7/7/2026 13:06"
182,"NO AI, 50+ Vintage Ghost Halloween Printable Wall Art Bundle (Digital Download) | S204","printable wall art, mega bundle prints, digital download, no ai artwork, cute ghost art, antiquewhiteart, antique white art, halloween printable, ghost wall art, fall printable art, vintage halloween, nursery prints, farmhouse decor",4519856939,"58","6","1","€21.07","€18.42",34,1.71,"7/7/2026 13:06"
