"#","LISTING","TAGS","LISTING ID","TOTAL VIEWS","FAVORITES","EST. SALES","EST. REVENUE","PRICE","LISTING AGE","DAILY VIEWS","LAST UPDATED"
241,"Frame TV Art, Ghost Family in Vintage Landscape, Fall TV Art, Halloween Samsung Frame TV Art, Autumn Spooky Painting, Digital Download |T166","antiquewhiteart, Art for Frame TV, Frame TV art Fall, Frame TV art ghosts, Frame TV pictures, Frame tv Halloween, Frame tv spooky, Halloween TV art, Samsung Frame Autumn, Samsung Frame TV art, Samsung Frame art, TV art download, Vintage Halloween",1579874507,"458","22","15","€84.6","€4.93",1016,0.45,"7/6/2026 13:54"
242,"Printable Ghosts in a Wildflower Field, Neutral Halloween Wall Art, Vintage Print, Spooky Halloween Fall Painting, Moody Fall Prints | A489","halloween decor, spooky season, vintage decor, antiquewhiteart, Cute Ghost Art, Cute Ghost Download, Cute Halloween Print, Dark Academia Art, Digital Download, Floral Ghost Print, Halloween Ghost Art, Halloween Printable, Fall Cottagecore",4333460199,"36","1","1","€7.17","€6.27",369,0.1,"7/6/2026 13:54"
243,"Printable Ghost in a Wildflower Field, Floral Halloween Wall Art, Vintage Botanical Print, Spooky Halloween Painting, Fall Prints | A539","halloween decor, spooky season, vintage decor, antiquewhiteart, Cute Ghost Art, Cute Ghost Download, Cute Halloween Print, Dark Academia Art, Digital Download, Floral Ghost Print, Halloween Ghost Art, Halloween Printable, Fall Cottagecore",4339764574,"78","0","2","€14.34","€6.27",357,0.22,"7/6/2026 13:54"
244,"Cute Ghost Holding Candle Wall Art, Printable Halloween Print, Cottagecore Nursery, Spooky Digital Print, Moody Dark Academia Decor | A521","Halloween Decor, Digital Download, Cottagecore Art, Antiquewhiteart, Halloween Print, Digital Art Prints, Ghost Print, Ghost Painting, Spooky Prints, Cute Ghost, Halloween ghost art, candle ghost print, Nursery Halloween",4334928799,"48","1","1","€6.64","€5.8",366,0.13,"7/6/2026 13:54"
245,"Samsung Frame TV Art, Autumn Hillside Landscape, Vintage Fall Painting, Digital Download, Warm Earth Tones, Farmhouse TV the Frame | TV698","frame tv art, samsung frame tv art, the frame tv art, autumn frame tv, vintage autumn, rustic fall, antiquewhiteart, warm earth tones, fall tv art, nature tv art, farmhouse tv decor, seasonal tv art, Neutral Fall Print",4350113425,"35","7","1","€5.93","€5.18",337,0.1,"7/6/2026 13:51"
246,"Printable Cute Ghost Holding Pumpkin Painting, Halloween Wall Art, Spooky Halloween Prints, Halloween Decor, Downloadable Wall Art | A491","halloween wall art, cute ghost print, spooky halloween art, antiquewhiteart, halloween printable, ghost print, pumpkin painting, halloween download, halloween art print, halloween decor, spooky season art, ghost wall art, digital download",4334005204,"61","6","2","€13.28","€5.8",368,0.17,"7/6/2026 13:51"
247,"Printable Vintage Haunted Forest Print, Halloween Wall Art, Warm-Toned Fall Prints, Ghost Digital Download, Spooky Autumn Home Decor | A604","halloween Wall Art, Printable Wall art, spooky fall decor, antiquewhiteart, halloween printable, fall wall art, digital download, vintage fall art, warm tone print, printable halloween, ghost artwork, autumn landscape, spooky prints",4358906023,"41","4","1","€7.71","€6.74",322,0.13,"7/6/2026 13:51"
248,"Printable Ghosts in a Wildflower Meadow, Vintage Halloween Wall Art, Moody Burguny Fall Print, Spooky Halloween, Digital Art Prints | A516","vintage decor, antiquewhiteart, Digital Download, Halloween Ghost Art, Halloween Printable, Wildflower Field, Cute Ghosts Art, fall wall decor, floral wall art, halloween decoration, halloween prints, halloween art print, vintage halloween",4334735205,"77","4","2","€14.34","€6.27",366,0.21,"7/6/2026 13:51"
249,"Fall Frame TV Art, Autumn Painting, Fall Landscape, Rustic Frame Tv Art, Country Fall Painting for TV, Vintage Style Fall Screensaver |TV489","Rustic Fall Art, Frame TV Art Fall, Digital Download, Art for Frame TV, Fall TV Art, Antique Painting, Frame TV Artwork, TV Artwork, Vintage Painting, Antiquewhiteart, Frame TV Art, FrameTV Art, Autumn Painting",1800917649,"76","3","2","€11.28","€4.93",656,0.12,"7/6/2026 13:51"
250,"Printable Halloween Wall Art, Ghost In Wildflower Meadow, Vintage Autumn Landscape, Rustic Warm-Toned Oil Painting, Digital Download | A596","Halloween Wall Art, Cute Ghost, Ghost Wall Art, Autumn Landscape, Vintage Painting, Rustic Fall, Antiquewhiteart, Moody Tones, Wildflower Meadow, Farmhouse Decor, Wildflower Field, Dark Wall Art, Spooky Wall Decor",4353662461,"34","2","1","€6.83","€5.97",331,0.1,"7/6/2026 13:51"
251,"Samsung Frame TV Art, Pumpkin Painting, Instant Download, Fall Art for Samsung Frame, Pumpkins Art, Samsung Art TV, Digital Download |TV170","Samsung Frame TV Art, Frame tv fall art, Vintage Autumn art, Fall Color, Frame TV Art, Instant Download, Samsung Download, Samsung Frame, Samsung TV, Fall Art, Halloween frame tv, Art for Tv, pumpkins art",1566094732,"752","52","24","€135.36","€4.93",1015,0.74,"7/6/2026 13:50"
252,"Halloween Witchy Prints, Printable Witch Wall Art, Halloween Rustic Wall Decor, Dark Academia, Halloween Painting, Digital Download | A508","Witch Print, Vintage Witch Print, Halloween Wall Art, Halloween Prints, Witch Art Print, AntiqueWhiteArt, Halloween Print, Witch Printable, Halloween Printable, Vintage Witch Art, Witchcore Print, Halloween Wall Decor, Spooky Wall Art",4334402759,"119","12","3","€17.79","€5.18",367,0.32,"7/6/2026 13:50"
253,"Halloween Frame TV Art, Witchy Spells TV Art, Vintage Halloween Witch Wall Art, Spooky Season, Digital Download, Samsung Frame TV Art |TV171","frame tv halloween, frame tv spooky, frame tv witch, halloween frame tv, halloween tv art, neutral halloween tv, samsung tv halloween, spooky tv art, vintage frame tv, vintage halloween tv, antiquewhiteart, witch frame tv art, witchy frame tv art",1567103310,"230","23","7","€40.25","€5.03",1014,0.23,"7/6/2026 13:50"
254,"Halloween Frame TV Art, Spooky Samsung Frame TV Art, Halloween Painting, Neutral Halloween Decor, Digital Download Art for TV | TV486","halloween art for Tv, antiquewhiteart, frame tv halloween, vintage frame tv, spooky tv art, frame tv spooky, vintage halloween tv, neutral halloween tv, samsung tv halloween, ghost frame tv art, samsung frame ghost, frame tv art ghosts, cute halloween art",1784475814,"163","4","5","€28.2","€4.93",660,0.25,"7/6/2026 13:50"
255,"Spooky Halloween Wall Art, Ghost in Vintage Landscape Print, Rustic Halloween Decor, Ghost Painting, Fall Season Art, Instant Download |A324","cute ghost, ghost painting, halloween decor, antiquewhiteart, dark academia, ghost wall art, digital printable, instant download, fall art print, ghost printable, halloween art, Spooky print, Pumpkin Field Art",1769425200,"539","35","17","€116.11","€5.97",689,0.78,"7/6/2026 13:49"
256,"Witchy Halloween Wall Art, Ghost Print, Rustic Halloween Decor, Spooky Ghost Painting, Vintage Style, Seasonal Print, Instant Download |A345","halloween decor, antiquewhiteart, dark academia, ghost wall art, digital printable, instant download, vintage library art, fall art print, ghost printable, halloween art, Spooky print, Witchy prints, Halloween Print",1794096179,"152","13","5","€34.15","€5.97",669,0.23,"7/6/2026 13:49"
257,"Printable Spooky Halloween Wall Art, Halloween Painting, Fall Art Print, Halloween Farmhouse Print, Spooky Art, Downloadable Print | A263","Halloween Print, Halloween Landscape, Spooky Wall Art, AntiqueWhiteArt, Cottagecore Print, Country Wall Art, Printable Country, Printable Fall Art, Halloween Wall Art, Halloween Country, Spooky Cottage, Printable Wall Art, Halloween Prints",1773695125,"219","19","7","€47.81","€5.97",708,0.31,"7/6/2026 13:46"
258,"Thanksgiving Wall Art, Pumpkins Painting, Instant Download, Farmhouse Landscape, Thanksgiving Print, Autumn Painting, Downloadable Art A176","landscape painting, antiquewhiteart, autumn landscape, autumn painting, Fall Color, Instant Download, Fall Art  Halloween, farmhouse fall print, Thanksgiving decor, pampkins print, pumpkins wall art, thanksgiving print, Thanksgiving",1616503065,"445","46","14","€95.62","€5.97",966,0.46,"7/6/2026 13:46"
259,"Printable Fall Wall Art, Fall Landscape Print, Deer Painting, Neutral Fall Decor, Seasonal Decor, Autumn Wall Art, Digital Download | A469","digital art print, printable wall art, vintage landscape, vintage prints, fall wall art, fall print, antiquewhiteart, neutral fall decor, Muted Autumn Art, Fall Landscape Print, Woodland  Print, Living Room Decor, Printable art",4327895607,"127","12","4","€28.68","€6.27",380,0.33,"7/6/2026 13:46"
260,"Samsung Fall Frame TV Art, Vintage Autumn Art for Frame Tv, Fall TV Art, Moody Fall Painting, EarthTone Decor, Autumn Frame TV Art | TV55","Frame TV Art Vintage, Samsung Frame TV Art, Autumn painting, moody fall wall art, moody vintage art, fall tv art, autumn landscape, earth tone decor, Frame tv fall art, fall frame tv, fall vintage tv art, fall art for tv, frame tv autumn art",1551464093,"534","27","17","€95.88","€4.93",1055,0.51,"7/6/2026 13:46"
261,"Cute Ghost in Fall Painting Frame TV Art, Spooky Halloween TV Art, Ghost in Vintage Aitumn Landscape Art for TV, Halloween Decor | TV94","Frame TV File, Frame TV Halloween, Frame TV art, Samsung Art Download, Samsung Frame TV, ghost wall decor, neutral halloween, Halloween Art, Frame TV Autumn, vintage painting, spooky Frame Tv, halloween art for Tv, antiquewhiteart",1567237707,"1,048","68","34","€191.76","€4.93",1033,1.01,"7/6/2026 13:46"
262,"Autumn Wildflowers Vintage Frame TV Art, Halloween Art for TV, Fall Wildflower Art, Halloween Decor, Digital Download Frame TV Art | TV87","Frame TV Art Vintage, Samsung Frame TV Art, autumn landscape, botanical wall art, landscape art, vintage aesthetic, vintage landscape, vintage painting, vintage wall art, vintage wildflowers, wildflower print, farmhouse frame Tv, Autumn frame tv arts",1561379959,"2,309","139","76","€428.64","€4.93",1041,2.22,"7/6/2026 13:45"
263,"Cute Ghosts Frame TV Art, Spooky Halloween Art for Tv, Ghosts in Vintage Painting, Frame TV Halloween, Neutral Halloween Decor | TV77","Frame TV File, Frame TV Halloween, Frame TV art, Samsung Art Download, Samsung Frame TV, ghost wall art, ghost wall decor, neutral halloween, Halloween Art, Frame TV Autumn, vintage painting, spooky Frame Tv, halloween art for Tv",1561335199,"566","29","18","€101.52","€4.93",1041,0.54,"7/6/2026 13:45"
264,"Fall Frame TV Art, Rustic Landscape Painting, Autumn Painting Samsung TV Art, Vintage Style Countryside Screensaver, Farmhouse TV Art |TV457","Samsung Frame TV Art, landscape painting, moody fall wall art, moody vintage art, fall frame tv art, fall tv art, vintage oil painting, Landscape frame tv, fall screensaver, halloween decor, Thanksgiving Tv Art, rustic fall tv art, AntiqueWhiteArt",1778094664,"194","8","6","€33.84","€4.93",672,0.29,"7/6/2026 13:45"
265,"Vintage Fall Landscape Print: Cozy Town, Warm Tones (Digital Download)","halloween Wall Art, Printable Wall art, spooky fall decor, antiquewhiteart, halloween printable, fall wall art, digital download, vintage fall art, spooky town print, warm tone print, printable halloween, neutral halloween, vintage cozy town",4371882192,"108","4","3","€23.13","€6.74",299,0.36,"7/6/2026 13:45"
266,"Printable Vintage Halloween Print, Cute Ghosts in a Boat Wall Art, Burgundy Moody Fall Landscape Painting, Spooky Digital Wall Art | A517","Digital Art Prints, Ghost Print, Halloween Printable, Ghost Painting, Digital Download, Ghosts Art Pint, Halloween Print, Antiquewhiteart, Cute Ghost, Spooky Prints, Dark Academia Decor, Printable Art, Halloween Art Print",4335838823,"48","3","1","€6.64","€5.8",364,0.13,"7/6/2026 13:45"
267,"Spooky Halloween Frame TV Art, Ghost in Vintage Library Samsung Frame TV Art, Rustic Halloween Decor, Ghost Painting, Instant Download TV446","halloween art for Tv, antiquewhiteart, frame tv halloween, vintage frame tv, spooky tv art, frame tv spooky, vintage halloween tv, samsung tv halloween, ghost frame tv art, samsung frame ghost, frame tv art ghosts, Ghost painting, Ghost screensaver",1770959074,"326","28","10","€59.3","€5.18",686,0.48,"7/6/2026 13:45"
268,"Digital Fall Print, Muted Fall Landscape Painting, Modern Farmhouse Fall Decor, Fall Prints, Vintage Autumn Print, Digital Download | A464","digital art print, fall wall decor, moody landscape, printable wall art, vintage prints, antiquewhiteart, fall prints, fall print, fall landscape, vintage print, fall decor, digital prints, lake painting",4331256552,"57","3","1","€7.17","€6.27",373,0.15,"7/6/2026 13:45"
269,"Autumn Deer Frame TV Art: Vintage Misty Forest Landscape (Digital Download)","Frame TV Art, Samsung Frame TV Art, The Frame TV Art, TV Art Digital, Autumn Frame TV, Antiquewhiteart, Vintage TV Art, Deer TV Art, Misty Forest, Nature TV Art, Fall Forest Painting, Fall Scene, Deer Painting",4353835585,"23","2","0","€0","€5.18",331,0.07,"7/6/2026 13:45"
270,"Samsung Frame TV Art, Witch Flying, Moody Foggy Town, Halloween Vintage Gothic Painting, Digital Download, Muted Witchy Art for TV | TV735","Frame TV Art, Samsung Frame TV Art, The Frame TV Art, Halloween Frame TV, Spooky TV Art, Witchy TV Art, Antiquewhiteart, Farmhouse TV Decor, Full Moon Art, Neutral Halloween, Vintage TV Art, TV Art Digital, Gothic Frame TV Art",4353830919,"47","1","1","€5.93","€5.18",331,0.14,"7/6/2026 13:45"
271,"Halloween Frame TV Art, Witch Painting, Witchy Farmhouse Art for TV, Halloween Rustic Painting, Spooky Samsung Tv Art, Witchy Decor | TV444","Frame TV Halloween, Samsung Art Download, Samsung Frame TV, antiquewhiteart, frame tv spooky, frame tv witch, halloween frame tv, halloween tv art, neutral halloween tv, samsung tv halloween, spooky tv art, vintage halloween tv, witchy frame tv art",1785150311,"282","18","9","€50.76","€4.93",686,0.41,"7/6/2026 13:45"
272,"Witchy Halloween Still Life Art for Samsung Frame TV (Digital Download) TV749","Frame TV Art, Samsung Frame TV Art, The Frame TV Art, Halloween Frame TV, Witchy TV Art, Spooky TV Art, Antiquewhiteart, Neutral Halloween, Rustic Halloween, Vintage Still Life, TV Art Digital, Witchy Still Life, Rustic Witchy Print",4353818452,"18","0","0","€0","€5.18",331,0.05,"7/6/2026 13:45"
273,"Spooky Halloween Wall Art, Ghost Toilet Art, Bathroom Halloween Decor, Fun Ghost Painting, Rustic Cottagecore Prints, Instant Download |A350","ghost painting, halloween decor, antiquewhiteart, ghost wall art, digital printable, instant download, ghost printable, halloween art, Spooky print, Bathroom Halloween, Cottagecore Prints, Bathroom Prints, Fun Halloween Prints",1787492816,"223","16","7","€47.81","€5.97",654,0.34,"7/6/2026 13:45"
274,"Funny Ghost with Doughnut Halloween Print: Quirky Haunted Decor (Digital Download)","Ghost Painting, Halloween Decor, Antiquewhiteart, Cute Ghost Art, Ghost Wall Art, Digital Printable, Fun Halloween Art, Instant Download, Halloween Art, Spooky Print, Fun Halloween Print, Kitchen Decor, Fun Halloween Decor",1782360620,"168","15","5","€35.85","€6.27",664,0.25,"7/6/2026 13:44"
275,"Printable Vintage Fall Wall Art, Neutral Halloween Wall Art, Bat Prints, Clouds Wall Art, Spooky Halloween Decor, Digital Download | A565","halloween Wall Art, Printable Wall art, bat wall art, new moon print, vintage halloween, neutral fall decor, spooky fall decor, antiquewhiteart, halloween printable, clouds wall art, fall wall art, eerie print, digital download",4344968638,"50","5","1","€7.71","€6.74",347,0.14,"7/6/2026 13:44"
276,"Large Wall Art, Wildflowers Print, Botanical Art, Rustic Spring Decor","Printed and Shipped, Shipped Canvas, Large Size Canvas, country farmhouse, large framed canvas, modern living room, nature landscape art, neutral oil painting, landscape painting, bedroom prints, spring decor, spring canvas art, Wildflower Field",4435593756,"2,772","103","44","€1,375","€27.32",191,14.51,"7/6/2026 12:52"
277,"Moody Frame TV Art, Dark Vintage Floral Oil Painting, Farmhouse Botanical, Flowers Art, Elegant Frame TV Art, Digital Download | TV596","Frame TV Art Vintage, Samsung Frame TV Art, Country Frame TV art, Muted Tonal Art, Farmhouse Decor, AntiqueWhiteAt, dark academia art, dark cottagecore art, landscape painting, rustic home decor, Floral Frame TV Art, Moody Art TV, Dark Floral Art",1884483233,"160","10","5","€40.75","€7.12",495,0.32,"7/6/2026 05:51"
278,"Printed Spring Cottage Rose Garden Painting, Mailed Country Landscape Print, Printed Cottagecore Wall Art, Farmhouse Print, AntiqueWhiteArt","Cottagecore Decor, Vintage Canvas Print, Framed Canvas Art, Large Canvas Art, Printed Wall Art, Vintage Landscape, Wildflower Print, Spring Decor, Wall Decor, Home Decor, Cottage Garden Decor, Cottage Decor, Spring Home Decor",1856751265,"1,659","77","34","€784.04","€20.16",550,3.02,"7/6/2026 03:52"
279,"Fall Frame TV Art, Autumn Painting, Fall Landscape, Rustic Frame Tv Art, Country Fall Painting for TV, Vintage Style Fall Screensaver |TV490","Rustic Fall Art, Frame TV Art Fall, Digital Download, Art for Frame TV, Fall TV Art, Antique Painting, Frame TV Artwork, TV Artwork, Vintage Painting, Antiquewhiteart, Frame TV Art, Fall Painting, Cottagecore Art",1787499062,"180","11","5","€28.2","€4.93",654,0.28,"7/6/2026 02:12"
280,"100+ Summer & Independence Day Frame TV Art Bundle | Americana Decor (Digital Download) |TS110","Frame TV art bundle, Frame TV bundle, Bundles Frame TV, digital download, american flag art, 4th july frame tv, usa patriotic art, americana decor, patriotic frame tv, independence decor, 4th of july bundle, independence day, antiquewhiteart",4491357366,"3,380","86","54","€1,733.94","€28.07",86,39.3,"7/6/2026 00:50"
281,"50+ Summer & Independence Day Wall Art Bundle, Vintage Americana Prints (Digital Download) S189","printable wall art, mega bundle prints, digital download, summer wall art, 4th of july bundle, 4th of july prints, independence day, americana decor, patriotic wall art, independence decor, american flag art, 4th july printable, Beach House Prints",4487611152,"1,436","56","29","€611.03","€18.42",93,15.44,"7/6/2026 00:50"
282,"Independence Day Frame TV Art, 4th of July Art, American Flag, Coastal Garden, Summer Art for TV, USA Oil Painting, Digital Download | TV432","Samsung Frame TV Art, Farmhouse Decor, Cottage Garden Decor, Coastal Frame TV, Summer Frame TV, Painting for TV, Independence Day, Frame TV Art, 4th of July Art, American Flag, Coastal Garden, USA Oil Painting, 4th of July Frame TV",1718257360,"14,592","782","482","€3,036.6","€5.51",789,18.49,"7/6/2026 00:50"
283,"Printable Independence Day Wall Art Set of 6, 4th of July Painting, American Flag Print, Vintage American Prints, Patriotic Wall Art | S113","Printable Wall Art, Downloadable Print, Coastal Print Set, 4th of July Painting, Independence Day, USA Painting, 4th of July Art, American Flag, USA Oil Painting, 4th of July Frame TV, Vintage Prints, antiquewhiteart, American Poster",4303003619,"6,718","321","168","€2,412.48","€12.55",431,15.59,"7/6/2026 00:50"
284,"50+ Independence Day Wall Art Bundle, Printable 4th of July Digital Download S188","printable wall art, mega bundle prints, digital download, summer wall art, 4th of july bundle, 4th of july prints, independence day, americana decor, patriotic wall art, independence decor, american flag art, 4th july printable, Beach House Prints",4487606712,"1,677","50","34","€716.38","€18.42",93,18.03,"7/6/2026 00:50"
285,"Printable Vintage Autumn Painting, Moody Fall Landscape, Farmhouse Decor, Autumn Authetic Art, Earth Tone Painting, Digital Download | A302","Autumn painting, autumn art print, autumn landscape, digital art print, fall wall decor, moody landscape, panoramic landscape, printable wall art, rustic art print, vintage landscape, warm tone print, vintage prints, Vintage Oil painting",1767356486,"2,899","248","95","€681.15","€6.27",693,4.18,"7/6/2026 00:22"
286,"Vintage Christmas Print Set of 20+: Neutral & Moody Holiday Gallery Wall (Digital Download) S164","Printable Wall Art, Christmas decor, antiquewhiteart, digital download, Christmas Tree Print, Digital Prints, vintage christmas, Winter Holiday Decor, christmas wall art, Christmas prints, Christmas Bundle, Large Set of Prints, Neutral Christmas",4398240065,"948","28","17","€455.43","€23.42",253,3.75,"7/6/2026 00:03"
287,"Vintage Christmas Print Set of 20+: Neutral & Moody Holiday Gallery Wall (Digital Download) S162","Printable Wall Art, Christmas decor, antiquewhiteart, digital download, Christmas Tree Print, Digital Prints, vintage christmas, Winter Holiday Decor, christmas wall art, Christmas prints, Christmas Bundle, Large Set of Prints, Neutral Christmas",4397513083,"21,129","778","397","€10,635.63","€23.42",254,83.19,"7/6/2026 00:03"
288,"Vintage Christmas Print Set of 20+: Moody Holiday Wall Art (Digital Download) S163","Printable Wall Art, Christmas decor, antiquewhiteart, digital download, Christmas Tree Print, Digital Prints, vintage christmas, Winter Holiday Decor, christmas wall art, Christmas prints, Christmas Bundle, Large Set of Prints, Moody Christmas",4397490605,"12,258","476","230","€6,161.7","€23.42",254,48.26,"7/6/2026 00:03"
289,"Fall Frame TV Art, Fall Forest Samsung TV Art, Vintage Autumn Painting, Country Landscape, Art for Frame Tv, Cottagecore TV Art | TV68","Samsung Frame TV Art, Living TV art, Autumn painting, cottagecore decor, country farmhouse, fall wall art, landscape painting, moody fall wall art, moody vintage art, fall frame tv art, fall tv art, vintage oil painting, Landscape frame tv",1556429491,"3,203","195","106","€597.84","€4.93",1048,3.06,"7/5/2026 23:12"
290,"Spring Wildflower Field Print, Neutral Landscape Painting (Digital Download) | A802","Wildflower Print, Downloadable Print, Downloadable Prints, Digital Prints, Floral Print, Neutral Wall Art, Printable Wall Art, Wildflower Field, Digital Floral Art, Meadow landscape, country farmhouse, AntiqueWhiteArt, Spring Decor",4467304516,"127","8","4","€32.84","€7.18",131,0.97,"7/5/2026 23:04"
291,"Advent Calendar, Vintage Christmas Bundle of Frame TV Arts, Santa Claus Art for TV, Christmas Tree Painting, Farmhouse Christmas Decor TS29","Samsung Frame TV, Frame TV Art Set, Frame Tv Christmas, country christmas, winter frame tv, Christmas Frame TV, Santa Frame TV, christmas tv art, digital download, farmhouse christmas, frame tv art, Christmas Tree Art, Advent Calendar Tv",1613401057,"1,196","25","19","€585.2","€26.92",970,1.23,"7/5/2026 20:16"
292,"Swan Lake, Samsung Frame TV Art, Vintage Moody Painting, Digital Download | TV933","Cottagecore decor, antique swan art, antique white art, classic frame tv art, swan frame tv art, swan lake decor, swan lake painting, swan painting tv art, vintage frame tv art, moody frame tv art, samsung frame tv, moody scenery, vintage frame tv",4460678641,"13","1","0","€0","€7.12",144,0.09,"7/5/2026 20:13"
293,"Samsung Frame TV Art, Country Summer TV Art, Muted Tonal Farmhouse Frame TV Art, Cottage Garden Painting, Digital Download | TV612","Frame TV Art Vintage, Samsung Frame TV Art, Muted Tonal Frame TV, Country Frame TV art, Cottage Country, Landscape Painting, AntiqueWhiteArt, Painting TV, Summer Frame TV Art, Farmhouse TV Art, Summer Landscape, Coastal Art for TV, Seasonal Frame Tv",4295164434,"131","14","4","€32.6","€7.12",448,0.29,"7/5/2026 20:10"
294,"Swan Lake Frame TV Art, Vintage Style Moody Painting, Digital Download | TV851","Cottagecore decor, antique swan art, antique white art, classic frame tv art, swan frame tv art, swan lake decor, swan lake painting, swan lake tv art, swan painting tv art, vintage frame tv art, moody frame tv art, moody fall painting, samsung frame tv",4445864277,"61","1","2","€16.3","€7.12",172,0.35,"7/5/2026 20:10"
295,"Neutral Summer Frame TV Art Set of 30, Frame TV Art Bundle, Coastal Paintings, TV Art Vintage Summer Collection, Summer Landscapes | TS03","Frame TV Art Vintage, Samsung Frame TV Art, Summer Frame TV, art for tv, art for tv frame, farmhouse frame tv, frame tv art, frame tv art set, frame tv art summer, living room tv art, samsung art, summer frame tv art, Neutral Art for TV",1503492519,"4,140","123","77","€2,085.93","€23.68",1126,3.68,"7/5/2026 20:09"
296,"Frame TV Art, Pumpkin Still Life, Vintage Thanksgiving Painting, Digital Download, Hisense Canvas Tv Art, Neutral Art for TCL TV | TV757","Samsung Frame TV Art, The Frame TV Art, Thanksgiving TV Art, Pumpkins TV Art, Rustic Fall, Antiquewhiteart, Farmhouse TV Decor, Seasonal TV Art, Vintage TV Art, Wall Art For TV, Fall TV Art, Hisense Tv Art, Art for TCL TV",4353821172,"289","11","9","€53.37","€5.18",331,0.87,"7/5/2026 20:09"
297,"Vintage 4th of July Art Prints, American Flag, Coastal Summer (Digital Download) S80","Printable Wall Art, Downloadable Print, Summer Wall Decor, Cottage Garden Decor, Coastal Print Set, Summer Art, 4th of July Painting, Independence Day, USA Painting, 4th of July Art, American Flag, USA Oil Painting, 4th of July Frame TV",1724000164,"11,159","609","280","€3,626","€11.32",778,14.34,"7/5/2026 20:08"
298,"Vintage Dark Flower Print, Dark Academia Botanical Wall Art, White Roses, Moody Roses Still Life Oil Painting, PRINTABLE Digital Art | A39","vintage white roses, white roses print, dark flower painting, dark floral print, gothic decor print, romantic vintage art, vintage floral art, dark academia, roses still life, antique flowers, flower oil painting, digital download, printable wall art",1406469836,"3,477","273","115","€660.1","€5.02",1242,2.8,"7/5/2026 20:06"
